628,九洲新世界花苑 2室2厅 南,159万,19113,天宁区兰陵街道,九洲新世界花苑,2室2厅1厨1卫,中楼层 (共20层),83.19㎡,平层,暂无数据,板塔结合,南,钢混结构,精装,两梯四户,有,暂无数据,2023-04-23,商品房,暂无数据,普通住宅,暂无数据,非共有,无抵押,未上传房本照片,,,,,,,,,,,,,,,,
629,繁华地段 ，户型方正，二房朝南， 业主诚售,120万,18692,天宁区兰陵街道,九洲新世界花苑,2室2厅1厨1卫,低楼层 (共20层),64.2㎡,平层,暂无数据,板塔结合,南,钢混结构,精装,两梯四户,有,暂无数据,2021-10-03,商品房,暂无数据,普通住宅,暂无数据,非共有,无抵押,未上传房本照片,繁华地段 ，户型方正，二房朝南， 房东诚售,,"1、契税：首套房，90平米以下成交价的1％，90平米以上成交价的1.5％, 二套房90平以上成交价的2%,2、增值税：产证满2年免收增值税，未满2年征收5.6％； 3、个税：产证满五年而且是一套住房，免收个税，未满5年成交价的1%",,小区旁配套成熟 配套设施 ：九洲新世界综市场，大润发，精品生鲜，医院，中国交通银行，中国工商银行，中国工商银行，邮政储蓄。大型商场齐：菜场，公园，娱乐场所，适宜居住，让你步行就满足一切需要,兰陵路于劳动路交汇处， 特色BRT快速公交车汇集地，靠地铁1号线，出行自驾、乘车均便利快捷,,,权属抵押：此房产权清晰，房源真实，业主诚心出售，看房方便，过户全程陪同,,,,,,,
630,乾盛兰庭 九洲繁华地段 精装两房装修高大上,180万,19696,天宁区兰陵街道,兰庭,2室2厅1厨1卫,高楼层 (共28层),91.39㎡,平层,暂无数据,板楼,南,钢混结构,精装,两梯四户,有,暂无数据,2021-09-09,商品房,暂无数据,普通住宅,暂无数据,非共有,无抵押,未上传房本照片,此房满两年正常交易，小区物业环境好中高层采光无遮挡，配套q..,小区介绍 小区环境优美，配套齐全，居民素质高，交通配套成熟，出行便利，小区安保物业负责，有公园，医院，商场……,1.契税：首套房，90平米以下成交价的1％，90平米以上成交价的1.5％，二套房90平以上成交价的2%；2.增值税：产证满2年免收增值税，未满2年征收5.6％； 3.个税：产证满五年而且是一套住房，免收个税，未满5年成交价的1%。,,成熟商圈，配套齐全，银行，医院，饭店，小吃，离九洲近，吃喝玩乐都全。,,,,,,,,,,,
631,户型方正绿园爱舍南区、、、、、、,125万,10639,武进区兰陵街道,绿园爱舍南区,4室2厅1厨1卫,高楼层 (共18层),117.5㎡,平层,暂无数据,板楼,南,钢混结构,简装,一梯四户,有,暂无数据,2021-03-14,商品房,暂无数据,普通住宅,暂无数据,共有,无抵押,未上传房本照片,此房满二，房屋空置，钥匙在店里，看房方便，简单装修，拎包...,小区环境优美，舒适安静 适宜居住，出门即有公交，菜场，银行 *市 美食等 人文素养好，乐于助人，相处和谐,"税费分析 1、契税：首套房，90平米以下成交价的1％，90平米以上成交价的1.5％, 二套房90平以上成交价的2%,2、增值税：产证满2年免收增值税，未满2年征收5.3％； 3、个税：产证满五年而且是一套住房，免收个税，未满5年成交价的1%",,小区紧靠弘阳生活广场，中吴大道，荆川公园， 湿地公园，江苏理工，学 校 小区门口就有酒店 银行 *市 菜场 生活设施方便。,,,,,,,,,,,
632,满五唯一 简装两房带储物间 工人新村南 看房方便,59.8万,11500,天宁区兰陵街道,工人新村南,2室2厅1厨1卫,高楼层 (共6层),52㎡,平层,暂无数据,板塔结合,南,砖混结构,简装,暂无数据,暂无数据,暂无数据,2021-04-21,商品房,暂无数据,普通住宅,暂无数据,非共有,无抵押,未上传房本照片,此房满五唯一，楼层好，采光无遮挡，房东诚心出售,,"契税：首套房，90平米以下成交价的1％，90平米以上成交价的1.5％, 二套房90平以上成交价的2%,2、增值税：产证满2年免收增值税，未满2年征收5.6％； 3、个税：产证满五年而且是一套住房，免收个税，未满5年成交价的1%",,小区内部就有社区医院，东方小 学，兰陵中 学距离小区就500米，800米有大型商场九洲新世界以及兰陵农贸市场，配套齐全,,,业主现诚心出售，证件齐，欢迎看房，随时恭候，如看中房子，价格可谈。,,,,,,,,
633,九州新世界君玺 2室2厅 南,175万,21444,天宁区兰陵街道,九州新世界君玺,2室2厅1厨1卫,高楼层 (共33层),81.61㎡,平层,暂无数据,板塔结合,南,钢混结构,精装,两梯四户,有,暂无数据,2022-10-14,商品房,暂无数据,普通住宅,暂无数据,非共有,无抵押,未上传房本照片,,,,,,,,,,,,,,,,
634,九洲新世界花苑精装，楼层采光好，四周配套齐,58.9万,13387,天宁区兰陵街道,九洲新世界花苑,1室2厅1厨1卫,低楼层 (共19层),44㎡,跃层,暂无数据,板塔结合,南,钢混结构,精装,四梯十六户,有,暂无数据,2020-07-11,商品房,暂无数据,普通住宅,暂无数据,非共有,无抵押,未上传房本照片,九洲新世界花苑精装，楼层采光好，四周配套齐,,,,,,房龄新，九洲新世界，热闹繁华，生活便利。此房房间朝南，中高楼层。采光充足。自住出租均可。,九洲新世界花苑精装， 楼层好，采光足。生活便利，闹中取静。自住出租均可。,,,年轻一族，刚需置业。养老自住，生活方便。繁华之地，交通便利。,,,,,
635,户型方正，采光充足，位置优越，配套齐全，交通便利,39万,8675,天宁区兰陵街道,江南经典花园,1室1厅1厨1卫,中楼层 (共17层),44.96㎡,平层,暂无数据,暂无数据,南,钢混结构,毛坯,暂无数据,暂无数据,暂无数据,2021-01-14,商品房,暂无数据,普通住宅,暂无数据,共有,无抵押,未上传房本照片,户型方正，采光充足，位置优越，商圈配套齐全，交通便利,,"税费解析：
税费分析 1、契税：首套房，90平米以下成交价的1％，90平米以上成交价的1.5％, 二套房90平以上成交价的2%,2、增值税：产证满2年免收增值税，未满2年征收5.6％； 3、个税：产证满五年而且是一套住房，免收个税，未满5年成交价的1%",,,交通方便，B15，B11，B1，B16，到火车站，新北高铁站，到武进大学城,,房东诚心出售， 提前联系随时看房 ，户型方正，毛坯，价格合理,,,,,,,,
636,兰陵欧尚 伟业zhen品简装二房 交通方便,120万,12372,武进区兰陵街道,伟业·臻品花园,3室2厅1厨1卫,高楼层 (共11层),97㎡,复式,暂无数据,板塔结合,南,钢混结构,简装,一梯两户,有,暂无数据,2020-05-23,商品房,暂无数据,普通住宅,暂无数据,共有,有抵押,未上传房本照片,房子满二年，户型方正，业主诚意出售，手续齐全,1、小区生活设施齐，商场、欧尚*市、菜市场、银行等，交通便捷； 2、小区内有健身器材，可供小区居民使用； 3、小区内建有地上停车场和地下车库； 4、小区内24小时保安值班,契税：A首套 90平以下1% B首套 90平以上1.5% C二套90平以下1% D二套90平以上2% E三套都是3% 增值税：满两年免征 不满2年权.额征收5.3% 个人所得税：不满5年征1%,,,,1、户型周正，格局分布合理，空间感好，通透性强，居住舒适； 2、楼层佳，朝向南北，视野开阔，采光透亮；,,,,,,,,,
637,满五唯一 新城长岛精装两房 前排全天采光 随时看房,90万,11393,武进区兰陵街道,新城长岛花园,2室2厅1厨1卫,低楼层 (共17层),79㎡,平层,暂无数据,板楼,南 北,钢混结构,精装,两梯三户,有,暂无数据,2023-08-14,商品房,暂无数据,普通住宅,暂无数据,非共有,无抵押,未上传房本照片,满五为一  格局好，采光充足，无遮挡，视野开阔，户型周正,小区生活实施齐全，商场，菜市场，银行等。2:小区内有健身器材，可供小区居民使用。3:小区停车位充足，建有地面临时停车位,"：
契税:A:首套 90平米以下1%B:首套90平米以上1.5%C;二套90平米以下1%D:二套90平米以上2%E:三套3%2.满2年免征，不满2年全额征收5.35%3.个人 :不满5年征1%满5年且房东名下唯一住房可免",,,,"：
小区距离弘阳广场0.5公里，湖塘吾悦广场2.4公里，湖塘易买得2.3公里，武进万达广场2.9公里，武进中医院2.6公里，常州第三人民医院3.7公里",,,,,,,,,
638,楼层好，采光足。生活便利，闹中取静。自住出租均可,150万,15790,天宁区兰陵街道,九洲新世界花苑,2室2厅1厨1卫,中楼层 (共25层),95㎡,平层,暂无数据,板塔结合,南,钢混结构,毛坯,两梯六户,有,暂无数据,2020-11-09,商品房,暂无数据,普通住宅,暂无数据,共有,无抵押,未上传房本照片,楼层好，采光足。生活便利，闹中取静。自住出租均可,房龄新，九洲新世界，热闹繁华，生活便利。此房两房朝南，中高楼层。采光充足。自住出租均可。,,,,,,业主现诚心出售，证件齐，欢迎看房，随时恭候。。。。。。。。。。。。。,,,年轻一族，刚需置业。 养老自住，生活方便 。繁华之地， 交通便利,,,,,
639,此房户型方正，通透明亮，阳台视野宽阔，采光很好。,78万,13632,武进区兰陵街道,棕榈湾,1室1厅1厨1卫,高楼层 (共18层),57.22㎡,平层,暂无数据,板楼,南,框架结构,精装,两梯六户,有,暂无数据,2022-01-07,商品房,暂无数据,普通住宅,暂无数据,共有,无抵押,未上传房本照片,此房户型方正，通透明亮，阳台视野宽阔，采光很好。,小区旁成熟社区，配套设施齐，菜场，娱乐场所，公园 银行 医院，适宜居住 让你步行就满足一切需要。,,,小区环境优美，配套齐全，居民素质高，交通配套成熟，出行便利，小区安保物业负责，有公园，医院，商场， 等等，,,,此房业主诚心出售，产权清晰，证件齐全，看房方便，要看房的约起来吧,,,,,,,,
640,江南佳园 户型格局好 采光充足 交通便利,150万,12821,天宁区兰陵街道,江南佳园,3室2厅1厨1卫,高楼层 (共15层),117㎡,平层,暂无数据,板塔结合,南,钢混结构,精装,两梯三户,有,暂无数据,2020-04-07,商品房,暂无数据,普通住宅,暂无数据,共有,无抵押,未上传房本照片,九洲新世界旁楼层好，户型好，全天阳光无遮挡,小区地址：天宁常州市天宁区迎宾路3号所属区域：天宁 兰陵邮 编：213000产权描述：70年物业类别：住宅建筑年代：2006年建成开 发 商：常州华泰房地产发展有限公司建筑类型：板塔结合建筑面积：41539平方米占地面积：47246平方米物业公司：常州华泰物业..,,,"商场：九州服装城,兰陵商圈医院：广化医院、广化医院邮局：兰陵邮政支局、中国邮政浦南支局银行：交通银行、建设银行、中国银行其他：兰园、江南春宾馆",【公交】 中吴大道兰陵路 （h1路环线; h2路环线）	848米 【公交】 清潭五村 （210路）	1047米 【公交】 三桥头 （14路; 38路; 220路）	279米 【公交】 兰陵路中吴大道(b) （b11路; b16路; b1路）	830米 【公交】 清南桥(工人新村) （210路,,,,,,,,,,
641,江南佳园，小面积，总价低，适合年轻人过渡，老人养老,35万,8314,天宁区兰陵街道,江南佳园,1室1厅1厨1卫,低楼层 (共15层),42.1㎡,平层,暂无数据,板塔结合,南,钢混结构,精装,两梯五户,有,暂无数据,2021-06-02,商品房,暂无数据,商住两用,暂无数据,共有,无抵押,未上传房本照片,公yu小区配套齐全，交通配套成熟，出行便利，小区安保物业负责,小区配套齐全，交通配套成熟，出行便利，小区安保物业负责，有公园，医院，商场， 等等,,,离九州新世界近，面积小，总价低。                                         ，,,,此房业主诚心出售，产权清晰，证件齐全，看房方便，价格还可以协商。,,,,,,民水,民电,2.45元/m3
642,三期小高层，近地铁，位置、楼层俱佳，闹中取静！,141万,16988,天宁区兰陵街道,兰陵尚品花园c区,2室2厅1厨1卫,中楼层 (共18层),83㎡,平层,暂无数据,板塔结合,南,钢混结构,精装,两梯三户,有,暂无数据,2021-03-17,商品房,暂无数据,普通住宅,暂无数据,共有,有抵押 3万元 客户偿还,未上传房本照片,兰陵尚品三期小高层，近地铁，地段、位置、楼层俱佳低总价,,,,,,,业主现诚心出售，证件齐，欢迎看房，随时恭候，如看中房子，价格实惠，小家庭、养老优选，闹中取静,此房产权清晰，房源真实，业主诚心出售，看房方便，过户全程陪同,,【居民素质】成熟小区，住户稳定，租客少，邻里关系相处比较融洽,,,,,
643,九洲新世界花苑商场旁交通便利、钥匙看房诚心出售,190万,21349,天宁区兰陵街道,九洲新世界花苑,2室2厅1厨1卫,高楼层 (共33层),89㎡,平层,暂无数据,板塔结合,南,钢混结构,精装,四梯三户,有,暂无数据,2022-08-12,商品房,暂无数据,普通住宅,暂无数据,共有,无抵押,未上传房本照片,核 心卖点：楼层好，采光佳，户型方正，看房方便~,,"税费解析：税费分析 1、契税：首套房，90平米以下成交价的1％，90平米以上成交价的1.5％, 二套房90平以上成交价的2%,2、增值税：产证满2年免收增值税，未满2年征收5.6％； 3、个税：产证满五年而且是一套住房，免收个税，未满5年成交价的1%",,,,,售房详情：业主现诚心出售，证件齐，欢迎看房，随时恭候。精装修无贷款,权属抵押：此房产权清晰，房源真实，业主诚心出售，看房方便，过户全程陪同,,,,,,,
644,九州新家园精装两房 房东诚心出售,120万,13954,天宁区兰陵街道,九洲新家园,1室2厅1厨1卫,中楼层 (共32层),86㎡,平层,暂无数据,塔楼,南,钢混结构,精装,两梯三户,有,暂无数据,2021-08-28,商品房,暂无数据,普通住宅,暂无数据,共有,有抵押,未上传房本照片,户型方正，楼层好，采光足，地铁口两百米,,"税费解析：
契税：首套房，90平米以下成交价的1％，90平米以上成交价的1.5％, 二套房90平以上成交价的2%。",,,"交通出行：
门口有公交车，BRT、和地铁1号线。中吴大道，地处常州中间位置，上常州哪里都方便！",,"售房详情：
业主现诚心出售，证件齐，欢迎看房，随时恭候，如看中房子，价格可谈",,,,,,,,
645,户型周正，格局分布合理，空间感好，通透性强。,78万,11356,天宁区兰陵街道,浦南新村(西区),2室1厅1厨1卫,低楼层 (共6层),68.69㎡,平层,暂无数据,板塔结合,南,钢混结构,精装,暂无数据,无,暂无数据,2023-08-06,商品房,暂无数据,普通住宅,暂无数据,共有,无抵押,未上传房本照片,户型周正，格局分布合理，空间感好，通透性强。,,1.契税：首套房，90平米以下成交价的1％，90平米以上成交价的1.5％，二套房90平以上成交价的2%；2.增值税：产证满2年免收增值税，未满2年征收5.6％； 3.个税：产证满五年而且是一套住房，免收个税，未满5年成交价的1%。,,,,,业主卖房改善换房，随时看房，业主随时可以签约，接受贷款，诚心出售。,此房产权清晰，房源真实，业主诚心出售，看房方便，过户全程陪同。,,,,,,,
646,房型方正，采光好，楼层视野好，明厨明卫,105万,11291,天宁区兰陵街道,浦北公寓,2室2厅1厨1卫,中楼层 (共6层),93㎡,平层,暂无数据,板塔结合,南,钢混结构,简装,暂无数据,暂无数据,暂无数据,2021-10-01,商品房,暂无数据,普通住宅,暂无数据,共有,无抵押,未上传房本照片,房型方正，采光好，楼层视野好，明厨明卫，,小区环境优美，配套齐全，居民素质高，交通配套成熟，出行便利，小区安保物业负责，有公园，医院，商场， 等等,"契税：首套房，90平米以下成交价的1％，90平米以上成交价的1.5％, 二套房90平以上成交价的2%",,,,,此房业主诚心出售，产权清晰，证件齐全，看房方便，价格还可以协商,,,,,,,,
647,九洲新世界花苑 地理位置佳 户型格局好,70万,11857,天宁区兰陵街道,九洲新世界花苑,1室1厅1厨1卫,高楼层 (共19层),59.04㎡,跃层,暂无数据,板塔结合,南,钢混结构,简装,四梯十六户,有,暂无数据,2020-11-30,商品房,暂无数据,普通住宅,暂无数据,共有,无抵押,未上传房本照片,繁华地段 精装修，保养很好 采光充足视野开阔 房东诚售,,"1、契税：首套房，90平米以下成交价的1％，90平米以上成交价的1.5％, 二套房90平以上成交价的2%,2、增值税：产证满2年免收增值税，未满2年征收5.6％； 3、个税：产证满五年而且是一套住房，免收个税，未满5年成交价的1%",,小区旁配套成熟 配套设施 ：九洲新世界综市场，大润发*市，精品生鲜*市，医院，中国交通银行，中国工商银行，中国工商银行，邮政储蓄。大型商场齐：菜场，公园，娱乐场所，适宜居住，让你步行就满足一切需要,兰陵路于劳动路交汇处， 特色BRT快速公交车汇集地，靠地铁1号线，出行自驾、乘车均便利快捷,,,,,,,,,,
648,中凉花园高楼层中装两房满五唯一业主诚售,68万,8500,武进区兰陵街道,中凉花园东区,2室2厅1厨1卫,高楼层 (共6层),80㎡,平层,暂无数据,板塔结合,南 北,钢混结构,简装,暂无数据,无,暂无数据,2023-10-01,商品房,暂无数据,普通住宅,暂无数据,共有,无抵押,未上传房本照片,中凉花园高楼层中装两房满五唯一业主诚售,,"1、契税：首套房，90平米以下成交价的1％，90平米以上成交价的1.5％, 二套房90平以上成交价的2%,2、增值税：产证满2年免增值税，未满2年征收5.6％； 3、个税：产证满五年而且是一套住房，免收个税，未满5年成交价的1%",,湖塘易买得CHAO市，吾悦广场，嘉禾电影城，万达广场，2；武进中医院，3；农业银行湖塘支行ATM，建设银行湖塘支行ATM,,户型周正，格局分布合理，空间感好，通透性强，居住舒适； 2、楼层佳，朝向南北，视野开阔，采光透亮；,,,,,,,,,
649,位置好 楼层好 采光好。精装修拎包就住,125万,14535,天宁区兰陵街道,弘阳上城,2室2厅1厨1卫,低楼层 (共33层),86㎡,平层,暂无数据,板塔结合,南,钢混结构,精装,两梯三户,有,暂无数据,2023-03-27,商品房,暂无数据,普通住宅,暂无数据,共有,有抵押,未上传房本照片,精装拎包就住，位置好 楼层好 采光好,"小区介绍：
小区地理位置优越，弘阳地产开发，小区全天保安，安全性高，环境优美，绿化好",,,小区配套有弘阳生活广场大型综合体。吃喝娱乐采购一站式解决，距离南大街，湖塘吾悦三公里。与江苏理工学院一路之隔，西面1千米有皇粮浜湿地公园，北面五百米荆川公园。小区配套有弘阳生活广场大型综合体。吃喝娱乐采购一站式解决,"交通出行：
小区位于中吴大道与长江路交汇处 公交车有23.56.23.28直达南大街火车站 医院 九洲新世界",,,,,,,,,,
650,九洲新世界君玺，精装修 中间楼层，采光充足,240万,27438,天宁区兰陵街道,九州新世界君玺,2室2厅1厨1卫,中楼层 (共22层),87.47㎡,平层,暂无数据,板塔结合,南,钢混结构,精装,暂无数据,暂无数据,暂无数据,2021-01-21,商品房,2022-01-21,普通住宅,满两年,非共有,无抵押,已上传房本照片,繁华地段 精装二房保养很好 采光充足视野开阔 房东诚售,,"1、契税：首套房，90平米以下成交价的1％，90平米以上成交价的1.5％, 二套房90平以上成交价的2%,2、增值税：产证满2年免收增值税，未满2年征收5.6％； 3、个税：产证满五年而且是一套住房，免收个税，未满5年成交价的1%",,小区旁配套成熟 配套设施 ：九洲新世界综市场，大润发*市，精品生鲜*市，医院，中国交通银行，中国工商银行，中国工商银行，邮政储蓄。大型商场齐：菜场，公园，娱乐场所，适宜居住，让你步行就满足一切需要,兰陵路于劳动路交汇处， 特色BRT快速公交车汇集地，靠地铁1号线，出行自驾、乘车均便利快捷,,,,,,,,,,
651,兰陵尚品 精装修两房 通透低总价 诚意价可谈,108万,14881,天宁区兰陵街道,兰陵尚品花园A区,2室2厅1厨1卫,低楼层 (共18层),72.58㎡,平层,59.73㎡,板塔结合,南 北,钢混结构,精装,两梯四户,有,暂无数据,2023-11-25,商品房,2010-10-09,普通住宅,满五年,共有,无抵押,已上传房本照片,户型周正，格局分布合理，空间感好，通透性强。,小区环境优美，绿化覆盖面积多，干净整洁，内有健身器材和小型娱乐设施。物业服务态度好。,1.契税：首套房，90平米以下成交价的1％，90平米以上成交价的1.5％，二套房90平以上成交价的2%；2.增值税：产证满2年免收增值税，未满2年征收5.6％； 3.个税：产证满五年而且是一套住房，免收个税，未满5年成交价的1%。,,,,,,此房产权清晰，房源真实，业主诚心出售，看房方便，过户全程陪同。,,,,,,,
652,九洲新世界花苑 精装保养好 楼层佳诚心出售看房方便,200万,17700,天宁区兰陵街道,九洲新世界花苑,3室2厅1厨1卫,中楼层 (共33层),113㎡,平层,暂无数据,板塔结合,南 北,钢混结构,精装,两梯三户,有,暂无数据,2023-11-27,商品房,暂无数据,普通住宅,暂无数据,非共有,无抵押,未上传房本照片,九洲新世界花苑 精装保养好 楼层佳诚心出售看房方便,小区旁成熟社区，配套设施齐，菜场、娱乐场所、公园、银行、医院，适宜居住,1.契税：首套房，90平米以下成交价的1％，90平米以上成交价的1.5％，二套房90平以上成交价的2%；2.增值税：产证满2年免收增值税，未满2年征收5.3％； 3.个税：产证满五年而且是一套住房，免收个税，未满5年成交价的1%。,,位于兰陵成熟商圈，配套齐全，银行，医院，饭店，小吃，吃喝玩乐都全。,,,,,,,,,,,
653,户型方正，采光无遮，小区环境优美,135万,11890,天宁区兰陵街道,九洲新家园,3室2厅1厨1卫,高楼层 (共32层),113.55㎡,平层,暂无数据,塔楼,南,钢混结构,精装,两梯三户,有,暂无数据,2023-11-22,商品房,2018-01-05,普通住宅,暂无数据,共有,有抵押,已上传房本照片,户型方正，采光无遮，小区环境优美,小区地理位置，绿化，居民素质高 配套：有健身器材，小型篮球场，可供小区居民使用 车位：停车位充足，建有地上停车场和地下车库 保安：小区内24保安巡逻,契税：A首套 90平以下1% B首套 90平以上1.5% C二套90平以下1% D二套90平以上2% E三套都是3% 增值税：满两年免征 不满2年权.额征收5.6% 个人所得税：不满5年征1%,,,,,此房业主诚心出售，产权清晰，证件齐全，看房方便，，放心购买、,,,,,,,,
654,绿园爱舍三房 户型方正 配套齐全 业主诚售 欢迎咨询,104万,8840,武进区兰陵街道,绿园爱舍南区,3室2厅1厨1卫,低楼层 (共18层),117.65㎡,平层,暂无数据,板楼,南,钢混结构,简装,两梯四户,有,暂无数据,2023-11-26,商品房,暂无数据,普通住宅,暂无数据,共有,无抵押,未上传房本照片,绿园爱舍三房 户型方正 配套齐全 楼层佳 采光无忧 欢迎咨询,小区环境优美，绿化成熟，适合居住，健身器材一应俱全，邻里关系友好,"首套房，90平米以下成交价的1％，90平米以上成交价的1.5％, 二套房90平以上成交价的2%,2、增值税：产证满2年免收增值税，未满2年征收5.3％； 3、个税：产证满五年而且是一套住房，免收个税，未满5年成交价的1%",,,,1、户型方正，格局分布合理，空间感好，通透性强，居住舒适 2、楼层佳，采光好，南北朝向，采光充足。3、小区环境优美，内有健身器材和娱乐广场，物业服务态度好。,,,,,,,,,
655,绿园爱舍电梯房，房东诚心出售，看房方便,122万,11245,武进区兰陵街道,绿园爱舍南区,3室2厅1厨1卫,低楼层 (共11层),108.5㎡,平层,暂无数据,板楼,南,钢混结构,简装,一梯三户,有,暂无数据,2023-11-23,商品房,暂无数据,普通住宅,暂无数据,共有,无抵押,未上传房本照片,电梯房，房东诚心出售，看房方便,小区内环境优美，干净整洁，楼栋分布均匀，24小时安保，停车位充足,1.契税：首套房，90平米以下成交价的1％，90平米以上成交价的1.5％，二套房90平以上成交价的2%；2.增值税：产证满2年免收增值税，未满2年征收5.6％； 3.个税：产证满五年而且是一套住房，免收个税，未满5年成交价的1%。,,北边，东边，南边是商各种配套，西边是荆川公园和菜场 ， ， ，，,,,,,,,,,,,
