313,近万达楼梯房中装三房中间楼层户型方正,135万,12108,武进区兰陵街道,中凉花园东区,3室2厅1厨1卫,中楼层 (共6层),111.5㎡,平层,暂无数据,板塔结合,南,混合结构,简装,暂无数据,暂无数据,暂无数据,2023-07-12,商品房,暂无数据,普通住宅,暂无数据,非共有,有抵押 70万元,未上传房本照片,近万达楼梯房中装三房中间楼层户型方正,,"1、契税：首套房，90平米以下成交价的1％，90平米以上成交价的1.5％, 二套房90平以上成交价的2%,2、增值税：产证满2年免增值税，未满2年征收5.6％； 3、个税：产证满五年而且是一套住房，免收个税，未满5年成交价的1%",,湖塘易买得CHAO市，吾悦广场，嘉禾电影城，万达广场，2；武进中医院，3；农业银行湖塘支行ATM，建设银行湖塘支行ATM,,户型周正，格局分布合理，空间感好，通透性强，居住舒适； 2、楼层佳，朝向南北，视野开阔，采光透亮； 3、小区环境优美，绿化面积覆盖高，干净整洁，内有健身器材和娱乐广场，物业服务态度好,,,,,,,,,
314,九州新世界君玺 精装大平层 未入住 中高楼层,660万,30407,天宁区兰陵街道,九州新世界君玺,4室2厅1厨2卫,中楼层 (共30层),217.06㎡,平层,暂无数据,板塔结合,南,未知结构,精装,一梯两户,有,暂无数据,2023-02-19,商品房,暂无数据,普通住宅,暂无数据,共有,有抵押,未上传房本照片,九州新世界君玺 精装大平层 未入住 中高楼层 看房方便,,此房满二，故个税是1%。契税：首套房90平米以下是成交价的1％，90平米以上是成交价的1.5％； 二套房90平米以下是成交价的1％，90平米以上是成交价的2％；三套房是成交价的3％,,朝阳综合市场，大润发，德安医院，银行交通银行，中国工商银行，中国工商银行，邮政储蓄.,,,,此房产权清晰。无抵押，房东对付款无要求，按照正常首付就可以。诚心出售,,,,,,,
315,九洲新家园，精装未入住，诚意出售,188万,16592,天宁区兰陵街道,九洲新家园,3室2厅1厨1卫,高楼层 (共32层),113.31㎡,平层,暂无数据,塔楼,南,钢混结构,精装,两梯三户,有,暂无数据,2023-03-06,商品房,暂无数据,普通住宅,暂无数据,共有,无抵押,未上传房本照片,格局好，采光好，户型方正 ，配套全，交通便利。,,契税：首套房，90平米以下成交价的1%，90平米以上成交价的1.5%；二套房90平米以上的成交价的2%。2 增值税:产证满2年免收增值税。3 个税：产证满5年而且是唯一一套住房，免收个税。,,九州大润发，华润万象城，兰陵大润发，丽华大润发，凤凰公园，连锁酒店，蔷薇湿地公园，各大银行，各类小吃美食一应。,,此房户型方正，通透性比较好，每个房间都有窗户，明厨明卫，采光无遮挡。,,,,,,,,,
316,九州新世界君玺精装修四房，房东诚心出售,385万,29203,天宁区兰陵街道,九州新世界君玺,4室2厅1厨2卫,低楼层 (共32层),131.84㎡,平层,暂无数据,板塔结合,南,钢混结构,精装,两梯三户,有,暂无数据,2020-08-26,商品房,暂无数据,普通住宅,暂无数据,共有,有抵押,未上传房本照片,品质小区，品质物业，采光好，交通方便，配套齐全,,,开发商精装修交付，业主自己重新翻修的，装修看起来很清爽，有空调，彩电，热水器，油烟机，煤气灶。,该小区为常州出名的品牌小区，物业绿化*好，紧靠九洲新世界商场，BRT站台,,此房四室两厅，两房朝南，客厅朝南，精装修，户型端正，房屋保养*好,,,,,,,,,
317,万达旁 外滩壹号 精装3房 河景房 房东诚心出售,170万,16182,武进区兰陵街道,外滩壹号花园,3室1厅1厨1卫,低楼层 (共33层),105.06㎡,平层,暂无数据,板塔结合,南 北,钢混结构,精装,两梯四户,有,暂无数据,2021-08-21,商品房,暂无数据,普通住宅,暂无数据,共有,无抵押,未上传房本照片,此房精装，户型方正，视野采光好,小区大门口湖塘桥北初中，距离刘海粟校区500米，金太阳幼儿园600米,,,"湖塘吾悦易买得1公里，吾悦广场1.1公里，嘉禾电影院1公里，万达广场1.3公里，兰陵欧尚2公里。2；银行；中国建设银行湖塘支行ATM1,7公里，中国农业银行湖塘支行ATM1.6公里，中国银行1.9公里。3；医院；武进中医院1.3公里",小区位于中吴大道与武宜路交叉口，出行交通有201，901，302，220，14.地铁一号线直达南大街，火车站，交通方便,,,,,,,,,,
318,弘阳上城二期 三房 房东诚意出售 看房方便,205万,16132,天宁区兰陵街道,弘阳上城,3室2厅1厨2卫,低楼层 (共27层),127.08㎡,平层,暂无数据,板楼,南,钢混结构,精装,两梯四户,有,暂无数据,2021-06-06,商品房,暂无数据,普通住宅,暂无数据,共有,有抵押,未上传房本照片,弘阳上城 精装三房  业主诚心出售,小区产权70年开发商常州弘阳广场置业有限公司物业公司:弘阳物业物业费1.6元每平方楼栋总数23栋房屋总数3631户，小区环境优美，居住舒适，自带游泳池，人车分流,"税费分析1、契税:首套房，90平米以下成交价的1%，90平米以上成交价的1.5%,二套房90平以上成交价的2%2、增值税:产证满2年免收增值税，未满2年征收5.6%;3、个税:产证满五年而且是一套住房，免收个税，未满5年成交价的",,弘阳生活广场:九州新世界，湖塘易买得*市，吾悦广场，嘉禾电影城，万达广场，2;常州第三人民医院，武进中医院，3;农业银行ATM，建设银行ATM，所处地区交通便利地面交通有56路23路12路28路直达南大街火车站,,,,,,,,,,,
319,世纪华城二期 电梯房中间楼层三房  毛坯出售,172万,14602,天宁区兰陵街道,世纪华城二期,3室1厅1厨1卫,中楼层 (共26层),117.8㎡,平层,暂无数据,板塔结合,南,钢混结构,毛坯,暂无数据,暂无数据,暂无数据,2021-11-29,商品房,暂无数据,普通住宅,暂无数据,非共有,无抵押,未上传房本照片,小区环境优美，配套齐全，毛坯，,居民素质高，交通配套成熟，出行便利，小区安保物业负责，有公园，医院，商场……,1.契税：首套房，90平米以下成交价的1％，90平米以上成交价的1.5％，二套房90平以上成交价的2%；2.增值税：产证满2年免收增值税，未满2年征收5.6％； 3.个税：产证满五年而且是一套住房，免收个税，未满5年成交价的1%。,,,,,,此房产权清晰无抵押，房源真实，业主诚心出售，看房方便，过户全程陪同。,,,,,,,
320,九洲新世界花苑2-2-1-1 65.00m² 145 万,135万,20770,天宁区兰陵街道,九洲新世界花苑,2室2厅1厨1卫,中楼层 (共20层),65㎡,平层,暂无数据,板塔结合,南,钢混结构,精装,两梯四户,有,暂无数据,2022-05-15,商品房,暂无数据,普通住宅,暂无数据,共有,无抵押,未上传房本照片,此房户型良好，楼层好，采光充足，房东诚心出售,,此房满二，故个税是1%。契税：首套房90平米以下是成交价的1％，90平米以上是成交价的1.5％； 二套房90平米以下是成交价的1％，90平米以上是成交价的2％；三套房是成交价的3％.,,生活设施齐 银行 市场 菜场 商场 饮食近在咫尺 生活起居很方便。,,,,此房产权清晰，房源真实，业主诚心出售，看房方便，过户全程陪同,,,,,,,
321,新城长岛急卖 随时看房 采光佳价格好谈,158万,12846,武进区兰陵街道,新城长岛花园,3室2厅1厨1卫,低楼层 (共18层),123㎡,平层,暂无数据,板塔结合,东南,钢混结构,简装,暂无数据,暂无数据,暂无数据,2023-06-14,商品房,暂无数据,普通住宅,暂无数据,非共有,无抵押,未上传房本照片,楼层好，采光充足。视野开阔。装修干净清爽，拎包即住,,契税：A首套 90平以下1% B首套 90平以上1.5% C二套90平以下1% D二套90平以上2% E三套都是3% 增值税：满两年免征 不满2年权 额征收5.3% 个人所得税：不满5年或不唯一征1%,,小区生活设施齐，商场、CHAO市、菜市场、银行等，交通便捷； 小区内有健身器材，小型篮球场，可供小区居民使用； 小区内停车位充足,,户型周正，格局分布合理，空间感好，通透性强，居住舒适； 楼层佳，朝向南北，视野开阔，采光透亮；,,,,,,,,,
322,绿园爱舍精装3房 中上楼层 户型佳 拎包住,150万,13637,武进区兰陵街道,绿园爱舍南区,3室1厅1厨1卫,中楼层 (共31层),110㎡,平层,暂无数据,板楼,南,钢混结构,精装,两梯四户,有,暂无数据,2021-04-18,商品房,暂无数据,普通住宅,暂无数据,非共有,无抵押,未上传房本照片,楼层佳，保养好拎包住，户型方正，,"小区介绍
小区地理位置佳，绿化好，居民素质高，小区有健身器材，活动场所。建有地下停车位，车位充足，二十四小时保安巡逻，菜场，*市，商场，银行等配套设施齐全，生活方便快捷，交通便利。","1：契税：首套房90平米以下1%，90平米以下1.5%；二套房90平米以下1%，90平米以上2%。3套及以上不论面积统一3%
2：增值税：满两年免征。不满两年5.3%
3：个人所得税：除满五唯一免征外，其他均按全额的1%征收。",,,,,诚心出售，价格可以再谈，欢迎看房，随时恭候本公司经过层层筛选，房东委托挂牌，诚心出售，价格以房东为主，产权清晰。无任何纠纷.放心考虑,,,,,,,,
323,九州商圈 生活便利 居住舒适 配套齐全,88万,13854,天宁区兰陵街道,工人新村南,4室2厅1厨2卫,高楼层 (共6层),63.52㎡,平层,暂无数据,暂无数据,南,未知结构,简装,暂无数据,暂无数据,暂无数据,2020-11-18,商品房,暂无数据,普通住宅,暂无数据,共有,有抵押,未上传房本照片,此房为顶楼，外楼梯复式，实际使用面积大，居住舒适,成熟社区，1公里处就是九州新世界商圈，门口有210公交车直达南大街，200米处就是兰陵菜场，银行*市一应俱全,,,,,,与602是同一个房东，这套有租客在不方便实勘，户型参考602，诚心置换,此房产权清晰，证件齐全，贷款房东自还，随时可还清，无户口，随时可签，欢迎看房,,,,,,,
324,精装修，楼层好，采光好，使用面积大。,165万,16667,天宁区兰陵街道,兰陵尚品花园c区,3室2厅1厨1卫,高楼层 (共31层),99㎡,平层,暂无数据,板塔结合,南,钢混结构,精装,一梯三户,有,暂无数据,2021-09-07,商品房,暂无数据,普通住宅,暂无数据,共有,有抵押 70万元,未上传房本照片,精装修，楼层好，采光好，使用面积大。,小区环境优美，配套齐全，居民素质高，交通配套成熟，出行便利，小区安保物业负责，有公园，医院，商场……,"契税：首套房，90平米以下成交价的1％，90平米以上成交价的1.5％, 二套房90平以上成交价的2%。",,,,,,此房无抵押，无查封，产权清晰，可以立即过户。房东诚心出售，价钱可谈。,,,,,,,
325,九州兰陵商圈， 工人新村， 高层，户型朝南,120万,12712,天宁区兰陵街道,工人新村南,5室2厅2厨2卫,高楼层 (共4层),94.4㎡,平层,暂无数据,板塔结合,南,砖混结构,简装,暂无数据,无,暂无数据,2021-03-08,商品房,暂无数据,普通住宅,暂无数据,非共有,无抵押,未上传房本照片,九州兰陵商圈， 工人新村， 高层 ，户型朝南,成熟社区，1公里处就是九州新世界商圈，门口有210公交车直达南大街，200米处就是兰陵菜场，银行*市一应俱全,"1、契税：首套房，90以下成交价的1％，90以上成交价的1.5％, 二套房90以上成交价的2%,2、增值税：产证满2年免收增值税，未满2年征收5.6％； 3、个税：产证满五年而且是一套住房，免收个税，未满5年成交价的1%",,成熟配套 九州新世界 广化桥 成熟大社区 服务配套齐全 商*成熟 生活便利,,,,,,,,,,,
326,兰庭三房 兰陵板块 交通出行方便,230万,16547,天宁区兰陵街道,兰庭,3室2厅1厨2卫,低楼层 (共28层),139㎡,平层,暂无数据,板楼,南,钢混结构,精装,两梯三户,有,暂无数据,2021-05-17,商品房,暂无数据,普通住宅,暂无数据,共有,无抵押,未上传房本照片,此房户型好，楼层好，小区环境优雅！,,税费：1契税 首套房90平以下 1%，90平以上1.5% 二套房90平以下1%，90平以上2% 三套房不论面积统一3% 2税： 满两年不论面积 全免 不满二年 收全额的5.6% 3个人所得税： 满两年1% 满五免个人所得税,,小区环境优雅 闹中取静 如生活在公园里面 九州新世界城市综合体和兰陵综合市场 适宜各种人群,BRT光华路兰陵站，B1.B16.B19. 九州新世界广场，小区南门有共享单车. 公交车:1路、31路,,,,,,,,,,
327,九州新世界君玺，小区前排，精装修3房， 小区环境优美,319万,27983,天宁区兰陵街道,九州新世界君玺,3室2厅1厨2卫,中楼层 (共32层),114㎡,平层,暂无数据,暂无数据,南 北,未知结构,精装,暂无数据,暂无数据,暂无数据,2023-04-23,商品房,暂无数据,普通住宅,暂无数据,共有,无抵押,未上传房本照片,九州新世界君玺，小区前排，精装修3房， 小区环境优美,小区生活设施齐，商场、菜市场、银行等，交通便捷，2.小区内有健身器材，可供小区居民使用；3.小区内停车位充足，建有地下停车场，人车分流。地上有会客停车位。4.小区内24小时保安巡逻,"税费解析：税费分析 1、契税：首套房，90平米以下成交价的1％，90平米以上成交价的1.5％, 二套房90平以上成交价的2%,2、增值税：产证满2年免收增值税，未满2年征收5.6％； 3、个税：产证满五年而且是一套住房，免收个税，未满5年成交价的1%",,九洲菜场 阳光MALL，九洲电脑城，九州服装城 医院：二院、三院 邮局：兰陵桥下 邮政储蓄 银行：工商银行、建设银行、交通银行 ，工作生活便利,,,,,,,,,,,
328,翔宇文苑 3房2厅2卫 3房朝南   拎包入住,120万,8815,武进区兰陵街道,翔宇文苑,3室2厅1厨2卫,低楼层 (共18层),136.14㎡,平层,暂无数据,板塔结合,南,钢混结构,精装,暂无数据,无,暂无数据,2021-01-23,商品房,暂无数据,普通住宅,暂无数据,共有,有抵押,未上传房本照片,优质户型 采光好，通透格局，楼层好，实用率大，交通方便。,小区环境优美，舒适安静，适宜居住，出门有公交，菜场，银行，美食等，生活配套齐全。,1、契税：90平米以下成交价1%，90平米以上成交价的1.5%，二套房90平米以上成交价的2%，三套房成交价的3%，2、增值税：房产证满二年免征增值税，未满2年征收5.3%的税，3、个税：房产证满五唯一，免收个税，满五不唯一收1%的税。,,小区环境优美，舒适安静，适宜居住，出门有公交，菜场，银行，美食等，永红医院 ，激光医院生活配套齐全。,,,,,,,,,,,
329,中凉六期，精装修，好楼层3楼，采光充足，可拎包入住,130万,10834,武进区兰陵街道,中凉新村六期,3室2厅1厨2卫,中楼层 (共6层),120㎡,平层,暂无数据,板塔结合,南,钢混结构,精装,暂无数据,无,暂无数据,2021-04-22,商品房,暂无数据,普通住宅,暂无数据,共有,无抵押,未上传房本照片,楼层好，视野开阔，配套设施齐全，交通便利,,契税：首套90平以内1%，二套1%，三套及以上3%，个税都是1%，未满2年的多征收5.3%增值税,此房精装修，全屋品牌家电家具，保养良好，可以拎包入住，为您节省很多装修时间和装修成本,1；小区距离兰陵欧尚1.2公里，九州新世界3公里，距离建设银行ATM230米，常州第三人民医院1.6公里,,,,,,,,,,,
330,采光刺眼 楼层位置好 精装修实木家具全留 拎包入住,155万,15252,天宁区兰陵街道,弘阳上城,3室2厅1厨1卫,中楼层 (共33层),101.63㎡,平层,暂无数据,板楼,南,钢混结构,精装,两梯四户,有,暂无数据,2023-07-25,商品房,暂无数据,普通住宅,暂无数据,共有,有抵押 20万元 公积金,未上传房本照片,"房东诚心出售, 价格可谈  精装修保养的很好， 拎包入住",1.小区生活实施齐全，商场，菜市场，银行等； 2：小区内有健身器材、小型篮球场，可供小区居民使用； 3：小区停车位充足，建有地面临时停车位以及底下停车位；4：小区内24小时保安巡逻。,首套房，90平米以下成交价的1％，90平米以上成交价的1.5％，二套房90平以上成交价的2%；2.增值税：产证满2年免收增值税，未满2年征收5.6％； 3.个税：产证满五年而且是一套住房，免收个税，未满5年成交价的1%。,,,,,,此房产权清晰，房源真实，业主诚心出售，看房方便，过户全程陪同。 此房无抵押，无查封，产权清晰，可以立即过户。房东诚心出售，价钱可谈,,,,,,,
331,新出急售 九州新世界广场精装修诚心出售,268万,16145,天宁区兰陵街道,九洲新世界,4室2厅2厨1卫,中楼层 (共27层),166㎡,平层,暂无数据,板塔结合,南,钢混结构,精装,暂无数据,暂无数据,暂无数据,2020-12-25,商品房,暂无数据,普通住宅,暂无数据,共有,无抵押,未上传房本照片,户型周正，采光无遮挡，中YANG空调，全屋暖气片，家具家电全留,,契税； a 首套90平以下1% b 首套90平以上1.5% c 二套90平以下1% d 二套90平以上2% e 三套都是3% 增值税 ；满两年免征 不满两年征收5.3%个人所得税 不满五年征1%,,,小区门口就有共享单车停放点，离小区100米有公交站台，可以乘坐1，12，31，52路等，出行方便,,,此房产权清晰，房源真实，业主诚心出售，看房方便，过户全程陪同,,,,,,,
332,九洲新世界花苑毛坯大3房 2房朝南方正楼层好房东诚售,236万,20885,天宁区兰陵街道,九洲新世界花苑,3室2厅1厨1卫,高楼层 (共33层),113㎡,平层,暂无数据,板塔结合,南 北,钢混结构,毛坯,两梯三户,有,暂无数据,2022-08-12,商品房,暂无数据,普通住宅,暂无数据,共有,无抵押,未上传房本照片,毛坯 楼层好，采光佳，户型方正，看房方便,,"契税：首套房，90平米以下成交价的1％，90平米以上成交价的1.5％, 二套房90平以上成交价的2%,2、增值税：产证满2年免收增值税，未满2年征收5.6％； 3、个税：产证满五年而且是一套住房，免收个税，未满5年成交价的1%",,,,,业主现诚心出售，证件齐，欢迎看房，随时恭候，如看中房子，价格可谈,此房产权清晰，房源真实，业主诚心出售，看房方便，过户全程陪同,,,,,,,
333,九洲君玺大平层五房二厅三卫双阳台中高层采光佳,630万,32308,天宁区兰陵街道,九州新世界君玺,5室2厅1厨3卫,高楼层 (共32层),195㎡,平层,暂无数据,板塔结合,南,钢混结构,精装,暂无数据,暂无数据,暂无数据,2022-01-17,商品房,暂无数据,普通住宅,暂无数据,共有,无抵押,未上传房本照片,"三个卧室朝南，客厅朝南,一个房间朝北，宽敞明亮",,,,到九洲新世界100米，到地铁一号线100米，到吾悦国际500米，到九洲农贸市场50米。,,"三个卧室朝南，客厅朝南,一个房间朝北，还有一个储物间。中高层，宽敞明亮。南北通风，采光好。",,无抵押，无贷款，产权清晰，房东诚意出售，楼层好，位置好。看房方便。,,,,,,,
334,兰庭，中高层采光好，三房两卫，价格看中可谈,210万,16536,天宁区兰陵街道,兰庭,3室2厅1厨2卫,高楼层 (共28层),127㎡,平层,暂无数据,板楼,南,钢混结构,精装,两梯三户,有,暂无数据,2023-08-18,商品房,暂无数据,普通住宅,暂无数据,共有,无抵押,未上传房本照片,房源为本小区实在房源，环境优美，楼间开阔，居住舒适性高。,1.小区生活设施齐，商场、菜市场、银行等，交通便捷，2.小区内有健身器材，小型篮球场，可供小区居民使用；3.小区内停车位充足，建有地下停车场，人车分流。地上有会客停车位。4.小区内24小时保安巡逻。,,,成熟商圈，配套齐全，银行，医院，饭店，小吃，离九洲近，吃喝玩乐都全。,小区楼下有共享单车，和两个公交站台，门口公交有多条线路，可到达江南商场，火车站等，交通四通八达，小区门口即是环城主干道，可通往常州各个区域。,1.户型周正，格局分布合理，空间感好，通透性强，居住舒适；2.楼层佳，南北朝向，视野开阔，采光通透。 房子复式楼房，格局好，南北通风户型，全天采光，户型方正视野好，干湿分离，明厨明卫。,,,,,,,,,
335,九洲新世界君玺双阳台采光好精装修未入住价格可谈,380万,26951,天宁区兰陵街道,九州新世界君玺,3室2厅1厨2卫,中楼层 (共32层),141㎡,平层,暂无数据,板塔结合,南,钢混结构,精装,两梯两户,有,暂无数据,2021-10-07,商品房,暂无数据,普通住宅,暂无数据,共有,无抵押,未上传房本照片,楼层好，采光佳，户型方正，看房方便,,"税费解析：税费分析 1、契税：首套房，90平米以下成交价的1％，90平米以上成交价的1.5％, 二套房90平以上成交价的2%,2、增值税：产证满2年免收增值税，未满2年征收5.6％； 3、个税：产证满五年而且是一套住房，免收个税，未满5年成交价的1%",,,,,业主现诚心出售，证件齐，欢迎看房，随时恭候。如看中房子，价格可谈。,此房产权清晰，房源真实，业主诚心出售，看房方便，过户全程陪同,,,,,,,
336,九洲新世界花苑 3室2厅 南 北,280万,19780,天宁区兰陵街道,九洲新世界花苑,3室2厅1厨2卫,高楼层 (共33层),141.56㎡,平层,暂无数据,板塔结合,南 北,钢混结构,精装,两梯四户,有,暂无数据,2022-08-16,商品房,暂无数据,普通住宅,暂无数据,非共有,有抵押 客户偿还,未上传房本照片,,,,,,,,,,,,,,,,
337,满五不唯一 视野开阔 采光充足 ， 商圈成熟 设施配套,230万,16429,天宁区兰陵街道,天安河滨花园,3室2厅1厨2卫,高楼层 (共16层),140㎡,平层,暂无数据,板塔结合,南,钢混结构,精装,两梯四户,有,暂无数据,2021-05-13,商品房,暂无数据,普通住宅,暂无数据,共有,无抵押,未上传房本照片,满五不唯一 视野开阔 采光充足 绿化佳 商圈成熟 设施配套,小区旁成熟社区，配套设施齐，菜场，娱乐场所，公园 银行 医院，适宜居住 让你步行就满足一切需要,,,,,2004年建造，房龄短，楼栋位置佳，有电梯，中间楼层，前后无遮挡，户型好，双向采光，采光充足,房东对这套房子也是爱不释手，若不是迫不得已，房东绝不出售这套房子如果您有意愿了，您可以随时打电话来看房，全天为您服务,,,,,,,,
338,兰陵尚品花园C区两室两厅精装房东诚心出售,160万,17205,天宁区兰陵街道,兰陵尚品花园c区,3室2厅1厨1卫,低楼层 (共22层),93㎡,平层,暂无数据,板塔结合,南 北,钢混结构,精装,暂无数据,暂无数据,暂无数据,2021-09-14,商品房,暂无数据,普通住宅,暂无数据,非共有,无抵押,未上传房本照片,精装修，楼层佳，采光好，无遮挡。,,契税：A首套 90平以下1% B首套 90平以上1.5% C二套90平以下1% D二套90平以上2% E三套都是3% 增值税：满两年免征 不满2年权 额征收5.3% 个人所得税：不满5年或不唯一征1%,,区生活设施齐，商场、菜市场、银行等，交通便捷； 小区内有健身器材，小型篮球场，可供小区居民使用； 小区内停车位充足，建有地上停车场和地下车库； 小区内24小时保安巡逻,,户型周正，格局分布合理，空间感好，通透性强，居住舒适； 楼层佳，朝向南北，视野开阔，采光透亮,,,,,,,,,
339,精装三房 家具家电全留 房东诚心出售,115万,11205,天宁区兰陵街道,浦南南村,3室2厅1厨1卫,中楼层 (共6层),102.64㎡,平层,暂无数据,板塔结合,南,钢混结构,简装,暂无数据,暂无数据,暂无数据,2022-03-31,商品房,暂无数据,普通住宅,暂无数据,共有,无抵押,未上传房本照片,房屋楼层好，日照采光充足，三个房间，使用面积大，,"小区环境优美,舒适安静适宜居住，出门即有公交、菜场、银行、商场、美食等，人文素养好，邻里乐于助人，相处和谐。",.契税：首套房，90平米以下成交价的1％，90平米以上成交价的1.5％，二套房90平以上成交价的2%；2.增值税：产证满2年免收增值税，未满2年征收5.6％； 3.个税：产证满五年而且是一套住房，免收个税，未满5年成交价的1%,,,,,此房业主诚心出售，产权清晰，证件齐全，看房方便，价格还可以协商。,,,,,,,,
