1614,清凉新村顶复，高阁楼，看中价格好谈哦。,106万,11398,天宁区茶山,清凉新村,4室2厅1厨2卫,高楼层 (共6层),93㎡,暂无数据,暂无数据,板楼,南,未知结构,简装,暂无数据,无,暂无数据,2023-07-03,商品房,暂无数据,普通住宅,暂无数据,共有,无抵押,未上传房本照片,格局好，采光好，户型方正 ，配套全，交通便利。,兰陵大润发，凤凰公园，连锁酒店，湿地公园，各大银行，各类小吃美食一应，还有在建的华润万象城，通车的一号线地铁。,,,小区区位也比较好，出行方便，小区环境还可以，适宜各个人群购买,契税：首套房，90平米以下成交价的1%，90平米以上成交价的1.5%；二套房90平米以上的成交价的2%。2 增值税:产证满2年免收增值税。3 个税：产证满5年而且是唯一一套住房，免收个税。,,,,,,,,,,
1615,此房楼层佳，采光足，南北通风，毛坯容易改造,330万,17278,天宁区茶山,银河湾明苑二期,4室2厅1厨3卫,中楼层 (共32层),191㎡,暂无数据,暂无数据,板塔结合,南,钢混结构,毛坯,两梯四户,有,暂无数据,2022-10-15,商品房,2018-04-11,普通住宅,未满两年,共有,有抵押,已上传房本照片,此房楼层佳，采光足，南北通风，毛坯容易改造,,,,1.户型周正，格局分布合理，空间感好，通透性强，居住舒适 2.楼层佳，南北朝向，视野开阔，采光通透 3.小区环境优美，绿化覆盖面积多，干净整洁，内有健身器材和小型娱乐设施。物业服务态度好,"1、契税：首套房，90平米以下成交价的1％，90平米以上成交价的1.5％, 二套房90平以上成交价的2%,2、增值税：产证满2年免增值税，未满2年征收5.6％； 3、个税：产证满五年而且是一套住房，免收个税，未满5年成交价的1%",,此房业主诚心出售，产权清晰，证件齐全，看房方便，价格可谈，放心购买,,,,,,,,
1616,华润国际剑桥澜湾小区 三房两卫南北通风 毛坯,242万,18474,天宁区茶山,华润国际社区剑桥澜湾,3室2厅1厨2卫,高楼层 (共32层),131㎡,暂无数据,暂无数据,板塔结合,南,钢混结构,毛坯,两梯三户,有,暂无数据,2023-05-23,商品房,暂无数据,普通住宅,暂无数据,共有,有抵押 75万元 建行 客户偿还,未上传房本照片,华润国际剑桥澜湾小区 三房两卫南北通风 毛坯,,,,小区生活设施齐，商场、菜市场、银行等，交通便捷 2.小区内有健身器材，小型篮球场，可供小区居民使用 3.小区内停车位充足，建有地下停车场，人车分流。地上有会客停车,1，首套 90平以下1% 。2，首套 90平以上1.5% 。3，二套90平以下1% 。4，二套90平以上2% 。5，三套都是3% 增值税：满两年免征 不满2年权.额征收5.6% 个人所得税：不满5年征1%,1.户型周正，格局分布合理，空间感好，通透性强，居住舒适；2、楼层佳，朝向南北，视野开阔，采光透亮；3、小区环境优美，绿化面积覆盖高，干净整洁，内有健身器材和娱乐广场，物业服务态度好；4、小区地理位置优越，交通便捷，辐射广，设施齐全，生活便利,,,,,,,,,
1617,小区位置好视野宽阔，采光充足，配套设施齐全。,135万,12966,天宁区茶山,人民新家园,2室2厅1厨1卫,高楼层 (共18层),104.12㎡,暂无数据,84.62㎡,板塔结合,南,钢混结构,简装,两梯三户,有,暂无数据,2023-05-09,商品房,2008-09-23,普通住宅,暂无数据,非共有,无抵押,已上传房本照片,人民新家园精装电梯3房 小高层采光好 随时看房,综合市场，大卖场，医院，银行交通银行，中国工商银行，中国工商银行，邮政储蓄。,,,,税费解析：此房满二，故个税是1%。契税：首套房90平米以下是成交价的1％，90平米以上是成交价的1.5％； 二套房90平米以下是成交价的1％，90平米以上是成交价的2％；三套房是成交价的3％。,,此房无贷款，无抵押，产权清晰。房东对付款无要求，按照正常首付就可以,,,,,,,,
1618,总价低的别墅  华润国际旁中吴雅苑小区  带院子,615万,21965,天宁区茶山,中吴雅苑,5室3厅1厨2卫,低楼层 (共2层),280㎡,,暂无数据,,南 北,砖混结构,毛坯,,,暂无数据,2022-01-07,商品房,暂无数据,别墅,暂无数据,非共有,有抵押 120万元,未上传房本照片,"业主诚心出售,手续齐全，价格公道，看房方便.",小区生活设施齐，商场、菜市场、银行等，交通便捷； 小区内有健身器材，小型篮球场，可供小区居民使用； 小区内停车位充足，建有地上停车场和地下车库；,,,,契税：A首套 90平以下1% B首套 90平以上1.5% C二套90平以下1% D二套90平以上2% E三套都是3% 增值税：满两年免征 不满2年权 额征收5.3% 个人所得税：不满5年或不唯一征1%,户型周正，格局分布合理，空间感好，通透性强，居住舒适； 楼层佳，朝向南北，视野开阔，采光透亮,,,,,联排,,,,
1619,华润剑桥澜湾 4室2厅2卫 毛坯 高层 采光好 诚心出售,199万,14676,天宁区茶山,华润国际社区剑桥澜湾,4室2厅1厨2卫,高楼层 (共32层),135.6㎡,暂无数据,暂无数据,板塔结合,南 北,钢混结构,毛坯,两梯三户,有,暂无数据,2022-07-28,商品房,暂无数据,普通住宅,暂无数据,共有,有抵押 82万元 客户偿还,未上传房本照片,此房户型方正，通透性比较好，每个房间都有窗户，明厨明卫，采光无遮挡。,,,,,兰陵大润发，丽华大润发，，华润万象城，凤凰公园，连锁酒店，湿地公园，各大银行，各类小吃美食一应。,契税：首套房，90平米以下成交价的1%，90平米以上成交价的1.5%；二套房90平米以上的成交价的2%。2 增值税:产证满2年免收增值税。3 个税：产证满5年而且是唯一一套住房，免收个税。,,022440124274,格局好，采光好，户型方正 ，配套全，交通便利。采光好,,,,,,
1620,24 一楼带花园 采光充足 配套齐全，,230万,40479,天宁区茶山,桃园新村,2室1厅1厨1卫,低楼层 (共5层),56.82㎡,暂无数据,暂无数据,板楼,南,砖混结构,精装,暂无数据,暂无数据,暂无数据,2023-11-05,商品房,暂无数据,普通住宅,暂无数据,共有,无抵押,未上传房本照片,户型方正 一楼带花园 采光充足 配套齐全，满二不唯一。,中医院 常州二院 大润发 文化宫 九洲商场 青果巷 红梅公园 大运河景观等,,,小区2002年建成，共27栋，860户，离地铁2号线红梅公园站仅400米，地铁1号线同济桥站700米，文化宫站800米，配套设施齐全，交通便利。,首套房90平米以下成交价的1％，90平米以上成交价的1.5％，二套房90平以下1%，以上2%，三套房不论大小均为3%； 增值税分析：产证满2年免收增值税，未满2年征收5.3％；个税：产证满五年而且是唯一一套住房，免收个税，未满5年成交价的1%。,,,,,,,,,,
1621,顶楼复式带外楼梯，户型方正，通透性强。,76万,11570,天宁区茶山,清凉新村,2室1厅1厨1卫,高楼层 (共5层),65.69㎡,暂无数据,暂无数据,板塔结合,南,钢混结构,精装,暂无数据,无,暂无数据,2022-11-03,商品房,2016-12-09,普通住宅,暂无数据,共有,无抵押,已上传房本照片,户型方正，格局分布合理，空间感好，通透性强。,生活配套齐全，医院，菜场，银行都有，成熟齐全，楼栋清晰分明，坐落有序，现场体验效果更加明显。,此房产权清晰，房源真实，业主诚心出售，看房方便，过户全程陪同。,,,"契税：首套房，90平米以下成交价的1％，90平米以上成交价的1.5％, 二套房90平以上成交价的2%。",,,,,,,,,,
1622,价格可谈！诚心出售！中间楼层！华润国际中吴府 六期,168万,18858,天宁区茶山,华润国际社区中吴府,3室2厅1厨1卫,高楼层 (共24层),89.09㎡,暂无数据,暂无数据,板塔结合,南,钢混结构,毛坯,两梯四户,有,暂无数据,2022-09-07,商品房,2017-11-17,普通住宅,满五年,共有,无抵押,已上传房本照片,地铁口新小区 毛坯三房 户型好采光好 央企开发有保障,兰陵大润发，丽华大润发，，华润万象城，凤凰公园，连锁酒店，湿地公园，各大银行，各类小吃美食一应,,,小区是华润自带物业安保和服务态度好，新小区环境好，配套齐，适合改善需求。 2、小区地理位置优越，交通便捷，旁边就是地铁1号线。小区内道路人车分流，设有滑滑梯，跷跷板等，儿童娱乐设施。老人休闲设施。生活配套齐全，万象城在建,首套 90平以下1% 。2，首套 90平及以上1.5% 。3，二套90平以下1% 。4，二套90平及以上2% 。5，三套都是3% 个人所得税：不是满五唯一年1%,,,,,,,,,,
1623,精装好房，业主诚意出售，看房方便，提前预约,214万,18715,天宁区茶山,华润国际社区中吴府,3室2厅1厨1卫,低楼层 (共16层),114.35㎡,暂无数据,暂无数据,塔楼,南,钢混结构,精装,两梯两户,有,暂无数据,2023-08-02,商品房,2020-09-28,商业,满两年,共有,有抵押 75万元 客户偿还,已上传房本照片,房东房子已经看好，诚意出售，看房方便，提前预约,,,,小区是华润自带物业安保和服务态度好新小区环境好配套齐适合改善需求2小区地理位置优越交通便捷旁边就是地铁1号线小区内道路人车分流设有滑滑梯跷跷板等儿童娱乐设施老人休闲设施配套齐全万象城在建,1，首套 90平以下1% 。2，首套 90平及以上1.5% 。3，二套90平以下1% 。4，二套90平及以上2% 。5，三套都是3% 个人所得税：不满5年征1%,1户型周正格局分布合理空间感好通透性强舒适得房率高；2楼层佳视野开阔采光透亮方便老人小孩,,,,,,,,,
1624,清凉新村   一楼带院子  诚心出售  价格可谈,85万,11390,天宁区茶山,清凉新村东区,2室2厅1厨1卫,低楼层 (共6层),74.63㎡,暂无数据,暂无数据,板楼,南 北,砖混结构,精装,暂无数据,无,暂无数据,2023-03-11,商品房,2002-06-10,普通住宅,暂无数据,非共有,无抵押,已上传房本照片,此房满五不唯一，地处清凉路繁华地段，出行方便，生活便利,该小区位于清凉光华路214号，近地铁，教育、医院、商场、银行等设施全，更有张太雷故居、人民公园给你欣赏游玩，属于成熟小区，适宜居住！,,6路、1路、2路、20路、33路经过，去往市区，郊区交通方便，不拥堵,,"1、契税：首套房，90平米以下成交价的1％，90平米以上成交价的1.5％, 二套房90平以上成交价的2%,2、增值税：产证满2年免收增值税，未满2年征收5.6％； 3、个税：产证满五年而且是一套住房，免收个税，未满5年成交价的1%",,,,,,,,,,
1625,清凉茗园精装修1室楼层好全天采光可2房清凉新村旁,90万,11983,天宁区茶山,清凉茗园,1室2厅1厨1卫,中楼层 (共11层),75.11㎡,暂无数据,75.11㎡,板塔结合,南 北,钢混结构,精装,暂无数据,暂无数据,暂无数据,2023-09-11,商品房,2014-11-10,普通住宅,满五年,共有,无抵押,已上传房本照片,清凉茗园精装修1房楼层好全天采光电梯看房随时,,,,位置：小区地理位置，绿化，居民素质高 配套：有健身器材，小型篮球场，可供小区居民使用 车位：停车位充足，建有地上停车场和地下车库 保安：小区内24保安巡逻,"税费分析 1、契税：首套房，90平米以下成交价的1％，90平米以上成交价的1.5％, 二套房90平以上成交价的2%,2、增值税：产证满2年免收增值税，未满2年征收5.6％； 3、个税：产证满五年而且是一套住房，免收个税，未满5年成交价的1%",,此房业主诚心出售，产权清晰，证件齐全，看房方便，价格还可以协商,,,,,,,,
1626,华润五期，户型方正，楼层佳，采光刺眼,175万,19887,天宁区茶山,华润凯旋门二期,3室2厅1厨1卫,高楼层 (共28层),88㎡,暂无数据,暂无数据,板塔结合,南 北,钢混结构,毛坯,一梯三户,有,暂无数据,2022-05-17,商品房,2018-06-07,普通住宅,暂无数据,共有,有抵押,已上传房本照片,此房格局好，南北有窗户，精装修三房，三开间朝南  没有浪费,小区生活设施齐，商场、菜市场、银行等，交通便捷； 小区内有健身器材，小型篮球场，可供小区居民使用； 小区内停车位充足，建有地上停车场和地下车库；,,,,,凯旋门二期是华润国际花园五期，2018年的房子。此房是小三房，毛坯，户型好三开间朝南，格局分布合理。,业主买了没住，现在打算处理多余资产，，看房提前约，价格好商量,,,,,,,,
1627,朝阳一村精装1室1卫 价格可谈 看房方便 房东诚售,49.8万,11368,天宁区茶山,朝阳一村,1室1厅1厨1卫,中楼层 (共4层),43.81㎡,暂无数据,暂无数据,塔楼,南,钢混结构,精装,暂无数据,暂无数据,暂无数据,2023-07-12,商品房,2020-12-28,普通住宅,暂无数据,共有,无抵押,已上传房本照片,朝阳一村精装1室1卫 价格可谈 看房方便 房东诚售,朝阳综合市场，大润发卖场，弘阳广场，德安医院，银行交通银行，中国工商银行，中国工商银行，邮政储蓄，弘阳广场。,此房无贷款，无抵押，产权清晰。房东对付款无要求，按照正常首付就可以。,,,税费解析：此房满二，故个税是1%。契税：首套房90平米以下是成交价的1％，90平米以上是成交价的1.5％； 二套房90平米以下是成交价的1％，90平米以上是成交价的2％；三套房是成交价的3％。,,,,,,,,,,
1628,天顺御和园 户型方正，前排无遮 业主诚售,119万,31234,天宁区茶山,天顺御和苑,2室1厅1厨1卫,高楼层 (共15层),38.1㎡,暂无数据,30.16㎡,板塔结合,南,钢混结构,精装,一梯六户,有,暂无数据,2023-09-09,商品房,2012-10-26,普通住宅,暂无数据,共有,无抵押,已上传房本照片,天顺御和园 户型方正，前排无遮 业主诚售 得房率高,,房子没有抵押，没有贷款，全产权，产权清晰，，业主卖房变现，诚心出售,交通出行：公交：BRT2、BRT12、BRT21、Y1、220路、903路等 地铁一号线 天宁室 站口。背靠红梅公园，门前东坡公园。边上儿童医院,,产权清晰 此房满二 目前存在的税费存在两个 1， 1%的个税，2，首套只有1.5%的契税，二套2.0%的契税,,,,,,,,,,
1629,丽华二村 3室1厅 南,75.8万,11662,天宁区茶山,丽华二村,3室1厅1厨1卫,低楼层 (共6层),65㎡,暂无数据,暂无数据,板塔结合,南,钢混结构,其他,暂无数据,暂无数据,暂无数据,2023-11-04,商品房,暂无数据,普通住宅,暂无数据,非共有,暂无数据,未上传房本照片,,,,,,,,,,,,,,,,
1630,清凉新村精装修2房位置好出行方便诚意出售价格可谈,72.8万,12432,天宁区茶山,清二社区,2室1厅1厨1卫,中楼层 (共6层),58.56㎡,暂无数据,58.56㎡,暂无数据,南,未知结构,精装,暂无数据,暂无数据,暂无数据,2023-03-27,商品房,2020-11-12,普通住宅,暂无数据,共有,有抵押,已上传房本照片,清凉新村光华路精装修2房楼层好,华润万象城，兰陵大润发，丽华大润发，凤凰公园，连锁酒店，蔷薇湿地公园，各大银行，各类小吃美食一应,,,,契税：首套房，90平米以下成交价的1%，90平米以上成交价的1.5%；二套房90平米以上的成交价的2%。2 增值税:产证满2年免收增值税。3 个税：产证满5年而且是唯一一套住房，免收个税。,,业主现诚心出售，证件齐，欢迎看房，随时恭候，如看中房子，好谈,,,,,,,,
1631,香梅花园精致好房 保养好 诚心出售,155万,14900,天宁区茶山,香梅花园,2室2厅1厨1卫,低楼层 (共11层),104.03㎡,暂无数据,暂无数据,板塔结合,南,钢混结构,精装,两梯两户,有,暂无数据,2022-09-05,商品房,2007-09-20,普通住宅,暂无数据,共有,无抵押,已上传房本照片,红梅公园旁楼层好，户型方正，看房方便,朝阳综合市场，大润发大卖场，德安医院，银行交通银行，中国工商银行，中国工商银行，邮政储蓄.,此房无贷款，无抵押，产权清晰。房东对付款无要求，按照正常首付就可以,,,契税：首套房90平米以下是成交价的1％，90平米以上是成交价的1.5％； 二套房90平米以下是成交价的1％，90平米以上是成交价的2％；三套房是成交价的3％,,,,,,,,,,
1632,六恒系统，采光好，看房提前联系,240万,20959,天宁区茶山,兢业园,3室2厅1厨1卫,高楼层 (共33层),114.51㎡,暂无数据,暂无数据,板塔结合,南,钢混结构,精装,两梯三户,有,暂无数据,2023-03-21,商品房,2018-05-11,普通住宅,暂无数据,共有,有抵押 150万元 中国银行 业主自还,已上传房本照片,朗诗競园精装3房 全天采光 ， 六恒系统,朝阳综合市场，大润发大卖场，德安医院，银行交通银行，中国工商银行，中国工商银行，邮政储蓄，弘阳广场，红梅公园,,,,税费解析：此房满二，故个税是1%。契税：首套房90平米以下是成交价的1％，90平米以上是成交价的1.5％； 二套房90平米以下是成交价的1％，90平米以上是成交价的2％；三套房是成交价的3％.,,,,,房适宜各年龄段人群居住，人车分流，里面有游乐场，菜场都有，健身房篮球馆都有。,,,,,
1633,朝阳三村，楼层佳，光线好，户型方正,62万,9976,天宁区茶山,朝阳三村,2室1厅1厨1卫,中楼层 (共5层),62.15㎡,暂无数据,暂无数据,板塔结合,南,钢混结构,简装,暂无数据,暂无数据,暂无数据,2023-05-19,商品房,1996-08-08,普通住宅,暂无数据,非共有,无抵押,已上传房本照片,楼层佳，光线好，户型方正，小区配套实施齐全,京杭运河从小区边经过，小区旁有朝阳中 学，出了小区就是红星市场，400米处是德安医院，隔着一条河就是东坡园,,小区门口有共享单车停车点，出小区一百米有公交站台，可以乘坐16路，55路，出行方便,,"1、契税：首套房，90平米以下成交价的1％，90平米以上成交价的1.5％, 二套房90平以上成交价的2%,2、增值税：产证满2年免收增值税，未满2年征收5.6％； 3、个税：产证满五年而且是唯 一套住房，免收个税，未满5年成交价的1%",,,,,,,,,,
1634,地铁口新小区 边户三房 户型好采光好 央企开发有保障,189万,19043,天宁区茶山,华润凯旋门,3室1厅1厨1卫,高楼层 (共31层),99.25㎡,暂无数据,暂无数据,板塔结合,南,钢混结构,精装,两梯四户,有,暂无数据,2022-12-13,商品房,2021-04-09,普通住宅,满两年,共有,有抵押 100万元 江苏银行 业主自还,已上传房本照片,小区是华润自带物业安保和服务态度好，新小区环境好，配套齐，适合改善需求。 2、小区地理位置优越，交通便捷，旁边就是地铁1号线。小区内道路人车分流，设有滑滑梯，跷跷板等，儿童娱乐设施。老人休闲设施。生活配套齐全，万象城在建,,,,1，首套 90平以下1% 。2，首套 90平及以上1.5% 。3，二套90平以下1% 。4，二套90平及以上2% 。5，三套都是3% 个人所得税：不是满五唯一年1%。,兰陵大润发，丽华大润发，，华润万象城，凤凰公园，连锁酒店，湿地公园，各大银行，各类小吃美食一应,,,022439511004,地铁口新小区 边户三房 户型好采光好 央企开发有保障,,,,,,
1635,清凉续建房，可正常付三成办贷款,68万,8705,天宁区茶山,清凉新村,3室1厅1厨1卫,高楼层 (共5层),78.12㎡,暂无数据,暂无数据,暂无数据,南 北,混合结构,简装,暂无数据,暂无数据,暂无数据,2022-12-06,商品房,2006-04-08,普通住宅,暂无数据,共有,无抵押,已上传房本照片,精装修楼层好，阳光充足，交通便利，配套设施齐全。,,此房产权清晰，业主诚心出售，看房方便，有多套住宅，卖房变现，有其他方面考虑,,小区生活实施齐全，商场，菜市场，银行等。 2：小区内有健身器材，可供小区居民使用。 3：小区停车位充足,"契税：首套房，90平米以下成交价的1％，90平米以上成交价的1.5％, 二套房90平以上成交价的2%。",,,,,,,,,,
1636,朝阳一村精装1室1卫 价格可谈 看房方便 房东诚售,45.8万,11273,天宁区茶山,朝阳一村,1室1厅1厨1卫,高楼层 (共4层),40.63㎡,暂无数据,暂无数据,暂无数据,南,未知结构,精装,暂无数据,暂无数据,暂无数据,2023-07-12,商品房,2021-03-26,普通住宅,暂无数据,共有,无抵押,已上传房本照片,朝阳一村精装1室1卫 价格可谈 看房方便 房东诚售,朝阳综合市场，大润发卖场，弘阳广场，德安医院，银行交通银行，中国工商银行，中国工商银行，邮政储蓄，弘阳广场。,此房无贷款，无抵押，产权清晰。房东对付款无要求，按照正常首付就可以。,,,税费解析：此房满二，故个税是1%。契税：首套房90平米以下是成交价的1％，90平米以上是成交价的1.5％； 二套房90平米以下是成交价的1％，90平米以上是成交价的2％；三套房是成交价的3％。,,,,,,,,,,
1637,华润国际旁和平国际 二房户型 采光好总价低,100万,14362,天宁区茶山,和平国际商业街,2室1厅1厨1卫,高楼层 (共18层),69.63㎡,暂无数据,暂无数据,板塔结合,南,钢混结构,精装,两梯四户,有,暂无数据,2023-02-22,商品房,2018-06-11,普通住宅,暂无数据,非共有,有抵押 20万元,已上传房本照片,简装两房可拎包入住，楼层好，全天采光。,综合市场，大润发，医院，银行交通银行，中国工商银行，中国工商银行，邮政储蓄,,小区楼下就有共享单车。小区南边就是中吴大道，门口就有公交，出行方便。,,,此房户型是南北朝向的，阳台和主卧在南边，中间是卫生间和厨房，最北边是次卧，小两房比较适合小夫妻居住。,,,,,,,,,
1638,华润国际五期 简装3房 户型方正全天采光  看中可谈,170万,19724,天宁区茶山,华润凯旋门二期,3室2厅1厨1卫,高楼层 (共34层),86.19㎡,暂无数据,暂无数据,板塔结合,南 北,钢混结构,简装,两梯三户,有,暂无数据,2023-04-17,商品房,2019-04-26,普通住宅,暂无数据,共有,无抵押,已上传房本照片,户型方正 婚房装修 拎包入住 看中价格可刀。,小区配套综合体华润万象及富强菜场、银行、便利店等生活配套设施；距离南大街约3公里、武进万达约1.5公里；距离常州三院2公里、常州二院2.5公里。,,,小区是华润五期，建于2018年，共建7栋；绿化30%，容积2.1；小区人车分流，停车位充足；华润物业，物业费1.6元；小区自带休闲走廊、儿童游乐区等。,首套 90平以下1% B首套 90平以上1.5% C二套90平以下1% D二套90平以上2% E三套都是3% 增值税：满两年免征 不满2年权 额征收5.3% 个人所得税：不满5年或不唯一征1%,,,,,,,,,,
1639,东城明居 三室 采光不遮挡，有钥匙 随时看房,145万,14043,天宁区茶山,东城明居,3室2厅1厨1卫,低楼层 (共25层),103.26㎡,暂无数据,暂无数据,板塔结合,南,混合结构,简装,两梯四户,有,暂无数据,2022-09-04,商品房,2018-06-21,普通住宅,暂无数据,共有,有抵押,已上传房本照片,客厅东西向 三房1卫，采光不遮挡,朝阳综合市场，大润发大卖场，德安医院，银行交通银行，中国工商银行，中国工商银行，邮政储蓄.,,,小区生活实施齐全，商场，菜市场，银行等。 2：小区内有健身器材，小型篮球场，可供小区居民使用。 3：小区停车位充足，建有地面临时停车位以及底下停车位。 4：小区内24小时保安巡逻,首套房，90平米以下成交价的1%，90平米以上成交价的1.5%；二套房90平米以上的成交价的2%。2 增值税:产证满2年免收增值税。3 个税：产证满5年而且是唯一一套住房，免收个税。未满5年成交价的1%,,,,,,,,,,
1640,华润国际五期毛坯3房 中间楼层 全天采光 房东诚心出售,150万,16902,天宁区茶山,华润凯旋门二期,3室2厅1厨1卫,中楼层 (共26层),88.75㎡,暂无数据,58.2㎡,板塔结合,南,钢混结构,毛坯,一梯六户,有,暂无数据,2023-10-10,商品房,2018-06-12,普通住宅,满五年,共有,有抵押 20万元,已上传房本照片,价格便宜   户型好   小区好 此房满五年 省税,,,地铁1号线 贯穿常州南北 跟地铁2号线直通 去东南西北都方便 中吴大道可直接上青洋高架和龙江高架 交通便利,,1，首套 90平以下1% 。2，首套 90平以上1.5% 。3，二套90平以下1% 。4，二套90平以上2% 。5，三套都是3% 增值税：满两年免征 不满2年权.额征收5.6% 个人所得税：不满5年征1%,,,,,,,,,,
