513,翠堤半岛花园一楼带底层复式精装修，诚心出售,290万,12447,天宁区茶山,翠堤半岛花园,5室2厅1厨3卫,低楼层 (共6层),233㎡,复式,暂无数据,板塔结合,南,钢混结构,精装,一梯两户,有,暂无数据,2021-12-25,商品房,暂无数据,普通住宅,暂无数据,共有,有抵押 110万元,未上传房本照片,格局好，采光好，户型方正 ，精装修底复带地下室。,丽华大润发，连锁酒店，湿地公园，各大银行，各类小吃美食一应。,,,小区生活实施齐全，商场，，菜市场，银行等。 2：小区内有健身器材，小型篮球场，可供小区居民使用。 3：小区停车位充足24小时安保巡逻维护小区安全。,契税：首套房，90平米以下成交价的1%，90平米以上成交价的1.5%；二套房90平米以上的成交价的2%。2 增值税:产证满2年免收增值税。3 个税：产证满5年而且是唯一一套住房，免收个税。,,,,,,,全屋地暖，大金的VRV中氧空调，科勒卫浴，两个储藏室、司米的橱柜，储物空间充足，家具齐全，业主装修了七十万，拎包入住。,,,
514,房子采光好，通透，两房朝南，空间大，看房方便,258万,26016,天宁区茶山,元丰苑,2室2厅1厨1卫,中楼层 (共7层),99.17㎡,平层,暂无数据,板楼,南,混合结构,简装,暂无数据,无,暂无数据,2021-02-21,商品房,暂无数据,普通住宅,暂无数据,共有,无抵押,未上传房本照片,房子采光好，通透，两房朝南，户型方正，看房方便的,医院：常州市中医院、常州市第二人民医院 购物：世纪华联*市(麻巷店)、常购连锁*市NO.093、物美*市(红梅南路)、瑞和泰，元丰菜场 其他：红梅公园、东坡公园、天宁寺,,公交：BRT2、BRT12、BRT21、Y1、220路、903路等地铁一号线已通车，2号线在建中,小区地理位置佳，绿化好，环境整洁，居民素质高，成熟小区生活配套齐全,,,,,,,,,,,
515,新装修，中间楼层，3开间朝南，双阳台。,150万,12788,天宁区茶山,五角场东村西区,3室2厅1厨2卫,低楼层 (共6层),117.3㎡,平层,暂无数据,塔楼,南,钢混结构,精装,暂无数据,暂无数据,暂无数据,2021-09-04,商品房,暂无数据,普通住宅,暂无数据,共有,无抵押,未上传房本照片,新装修，中间楼层，3开间朝南，双阳台。,,,,,"首套房，90平米以下成交价的1％，90平米以上成交价的1.5％, 二套房90平以上成交价的2%,2、 增值税：产证满2年免增值税，未满2年征收5.6％； 3、个税：产证满五年而且是一套住房，免收个税， 未满5年成交价的1%",,房东诚心出售，产权清晰，房源真实，非诚勿扰，看中价格可以小谈,,,本小区适应年龄段不限，有红梅公园，东坡公园，菜场离得近，方便出行。,,,,,
516,光明世家 天宁茶山 大三房价格美丽,145万,10985,天宁区茶山,光华世家,3室2厅1厨2卫,低楼层 (共18层),132㎡,平层,暂无数据,板塔结合,南,钢混结构,简装,两梯三户,有,暂无数据,2020-10-29,商品房,暂无数据,普通住宅,暂无数据,共有,无抵押,未上传房本照片,光华世家精装3房 满二 中间楼层全天采光 可刀 房东诚心卖,综合市场，德安医院，银行交通银行，中国工商银行，中国工商银行，邮政储蓄.,此房无贷款，无抵押，产权清晰。房东对付款无要求，按照正常首付就可以。,,,税费解析：此房满二，故个税是1%。契税：首套房90平米以下是成交价的1％，90平米以上是成交价的1.5％； 二套房90平米以下是成交价的1％，90平米以上是成交价的2％；三套房是成交价的3％,,,,,,,,,,
517,地铁壹号线旁 平层大宅 四房 配套齐全 交通便利,208万,13000,天宁区茶山,人民新家园,4室2厅1厨2卫,中楼层 (共6层),160㎡,平层,暂无数据,板塔结合,南,钢混结构,简装,暂无数据,暂无数据,暂无数据,2021-10-14,商品房,暂无数据,普通住宅,暂无数据,共有,无抵押,未上传房本照片,此房满五年  大平层 南北通风 户型方正。楼层好 视野开阔,综合市场，医院，银行交通银行，中国工商银行，中国工商银行，邮政储蓄.,此房无贷款，无抵押，产权清晰。房东对付款无要求，按照正常首付就可以,,,税费解析：此房满二，故个税是1%。契税：首套房90平米以下是成交价的1％，90平米以上是成交价的1.5％； 二套房90平米以下是成交价的1％，90平米以上是成交价的2％；三套房是成交价的3％,,,,,,,,,,
518,蔷薇家园精装修诚心出售、好楼层方正通透,150万,11719,天宁区茶山,蔷薇家园,3室2厅1厨1卫,高楼层 (共27层),128㎡,平层,暂无数据,板塔结合,南,钢混结构,精装,一梯三户,有,暂无数据,2022-05-07,商品房,暂无数据,普通住宅,暂无数据,非共有,无抵押,未上传房本照片,小区地理位置优越，生活交通配套便利，户型方正,成熟社区，配套设施齐全，菜场，娱乐场所，公园。适合居住。小区内有健身器材,,,小区生活实施齐全，商场，，菜市场，银行等。 2：小区内有健身器材，小型篮球场，可供小区居民使用。 3：小区停车位充足,1、契税：首套房，90平米以下1%，90平米以上1.5%。 二套房：90平米以下1%，90平米以上2%。2、增值税：总额征收5.6%，产证满2年免收,,,,,,,,,,
519,视野宽阔，采光充足，配套实施齐全，交通便利。,90万,12232,天宁区茶山,清凉新村,3室1厅1厨1卫,中楼层 (共4层),73.58㎡,平层,暂无数据,板塔结合,南,钢混结构,精装,暂无数据,无,暂无数据,2023-04-03,商品房,暂无数据,普通住宅,暂无数据,共有,有抵押 业主自还,未上传房本照片,此房楼层好，视野宽阔，采光充足，配套实施齐全，交通便利。,,,,小区旁成熟社区，配套设施齐，菜场、娱乐场所、公园、银行、医院，适宜居住，,1.契税：首套房，90平米以下成交价的1％，90平米以上成交价的1.5％，二套房90平以上成交价的2%；2.增值税：产证满2年免收增值税，未满2年征收5.6％； 3.个税：产证满五年而且是一套住房，免收个税，未满5年成交价的1%。,此房户型方正，三室室一厅面积适中，采光好，通透性强，日照充足,,,,,,,,,
520,128平 大三房 精装保养好 华润国际,210万,15964,天宁区茶山,华润·中央公园,3室2厅1厨2卫,中楼层 (共33层),131.55㎡,平层,暂无数据,板楼,南,钢混结构,精装,两梯三户,有,暂无数据,2023-04-03,商品房,暂无数据,普通住宅,暂无数据,共有,有抵押 0万元 / 业主自还,未上传房本照片,房型方正，明厨明卫采光好，通透敞亮，三房朝南,,,,环境优美，小区内部环境好，绿化高，休闲设施齐全，儿童游乐场所，健身器材。24小时安保服务，管家式服务,,户型方正朝南，格局布局好，空间感好，通透性强，居住舒适 2、南北朝向，视野开阔，采光透,,,,,,精装保养好，品牌家具家电，实地可以看房，用的环保材料，诚心卖此房,,,
521,地铁口，国泰新都，精装修，户型方正，采光充足。,310万,29125,天宁区茶山,国泰新都,2室2厅1厨1卫,低楼层 (共11层),106.44㎡,平层,暂无数据,板塔结合,南,钢混结构,精装,两梯两户,有,暂无数据,2022-04-08,商品房,暂无数据,普通住宅,暂无数据,共有,无抵押,未上传房本照片,24中 上下学便利 地铁口商圈 出行便利,"公园：小区自带一个青山公园 ,2公里内有红梅公园菜场：怡康菜场 ，锦绣菜场，市：2公里内有大润发市 欧尚市。医院：2公里内有青山湾社区医院，武进医院，一院 ，二院",,小区地处市区交通便利：门口有公交站台BRT 24路 31路等 1公里内有火车站 ，汽车站，可以上环城高架,,"1、契税：首套房，90平米以下成交价的1％，90平米以上成交价的1.5％, 二套房90平以上成交价的2%, 三套房无论面积大小都是3%；2、增值税：产证满2年免收增值税，未满2年征收5.6％； 3、个税：产证满五年而且是一套住房，免收个税，未满5年成交价的1%",,,,,,,,,,
522,户型方正 采光好 房东诚心出售，楼下还有10平房储藏室,168万,12924,天宁区茶山,人民新家园,3室2厅1厨2卫,低楼层 (共9层),130㎡,平层,暂无数据,板塔结合,南,钢混结构,简装,暂无数据,暂无数据,暂无数据,2020-12-22,商品房,暂无数据,普通住宅,暂无数据,共有,无抵押,未上传房本照片,区环境优雅，配套成熟，交通便利，居住舒适,,,,位置：小区地理位置，绿化，居民素质高 配套：有健身器材，小型篮球场，可供小区居民使用 车位：停车位充足 保安：小区内24保安巡逻 交通出行：小区出行便利。出小区门口就有共享单车，公交站等，小区出门步行就可以.,首套房90平以下成交价的1%，90平以上成交价的1.5%； 二套房90平以下1%，以上2%； 三套房不论大小均为3%,,此房产权清晰，房源真实，业主诚心出售，过户全程陪同，安心交易,,,,,,,,
523,业主诚心出售，l手续齐全，价格公道，看房方便,156万,17529,天宁区茶山,华润国际社区剑桥澜湾,3室2厅1厨1卫,高楼层 (共18层),89㎡,平层,暂无数据,板塔结合,南 北,钢混结构,精装,两梯三户,有,暂无数据,2021-04-26,商品房,暂无数据,普通住宅,暂无数据,共有,无抵押,未上传房本照片,业主诚心出售，l手续齐全，价格公道，看房方便,,,,小区生活设施齐，商场、*市、菜市场、银行等，交通便捷； 小区内有健身器材，小型篮球场，可供小区居民使用； 小区内停车位充足，建有地上停车场和地下车库； 小区内24小时保安巡逻,契税：A首套 90平以下1% B首套 90平以上1.5% C二套90平以下1% D二套90平以上2% E三套都是3% 增值税：满两年免征 不满2年权 额征收5.3% 个人所得税：不满5年或不唯一征1%,户型周正，格局分布合理，空间感好，通透性强，居住舒适； 楼层佳，朝向南北，视野开阔，采光透亮；,,,,,,,,,
524,新乐花园 4室2厅 南,169.8万,13970,天宁区茶山,新乐花园,4室2厅1厨1卫,高楼层 (共18层),121.55㎡,平层,暂无数据,板塔结合,南,钢混结构,精装,一梯三户,有,暂无数据,2020-10-12,商品房,暂无数据,普通住宅,暂无数据,共有,无抵押,未上传房本照片,,,,,,,,,,,,,,,,
525,天鹅湖花园复式精装修非顶楼，采光全天随时看房,285万,20213,天宁区茶山,天鹅湖花园,4室2厅1厨2卫,高楼层 (共23层),141㎡,复式,暂无数据,塔楼,南,钢混结构,精装,暂无数据,暂无数据,暂无数据,2022-02-23,商品房,暂无数据,普通住宅,暂无数据,共有,无抵押,未上传房本照片,此房通风效果好，户型格局方正，楼层好，采光佳。拎包入住,交通线路有： 10路、16路、 H1至丽华二村下车 丽华幼儿园 丽小 等 还配置多家银行 方便快捷！,,,,,该房屋采光好无遮挡 适合一家居住，通透户型，另外进户有一排柜子可以放鞋子和收纳，带大露台可以玩耍。,,,,适合刚需人群和楼梯房改善人群，可做婚房，楼下大润发，东边几百米有大型免费公园 ，可去锻炼身体和增进亲子关系,,,,,
526,桃园新村，二楼，两房朝南，采光好,300万,43669,天宁区茶山,桃园新村,3室1厅1厨1卫,中楼层 (共5层),68.7㎡,平层,暂无数据,板楼,南 北,砖混结构,精装,暂无数据,无,暂无数据,2021-06-02,商品房,暂无数据,普通住宅,暂无数据,共有,无抵押,未上传房本照片,两房朝南，采光好，楼层佳，位置好，随时看房,小区附 近有商场，菜场，地铁，医院，红梅公园和东坡公园，生活设施一应俱全,,,,"契税：首套房，90平米以下成交价的1％，90平米以上成交价的1.5％, 二套房90平以上成交价的2%,2、增值税：产证满2年免收增值税，未满2年征收5.6％； 3、个税：产证满五年而且是一套住房，免收个税，未满5年成交价的1%",,,,,本小区适应年龄段不限，有红梅公园，东坡公园，菜场离得近，方便出行,,,,,
527,华润国际社区剑桥澜湾 四室两厅 配套设施齐全,265万,18775,天宁区茶山,华润国际社区剑桥澜湾,4室2厅1厨2卫,低楼层 (共18层),141.15㎡,平层,暂无数据,板塔结合,南 北,钢混结构,毛坯,一梯三户,有,暂无数据,2021-09-23,商品房,暂无数据,普通住宅,暂无数据,非共有,有抵押 30万元 公积金,未上传房本照片,此房户型好 视野开阔 采光充足 配套设施齐全，交通便利,生活设施齐，银行，市场，商城，菜场，饮食近在咫尺 生活起居很方便,此房产权清晰，房源真实，业主诚心出售，看房方便，过户全程陪同,,,,,业主诚心售房 证件齐全 欢迎看房，随时恭候，如看中房子，价格可谈,,,,,,,,
528,户型方正 采光好 房东诚心出售 环境好,198万,15231,天宁区茶山,景泰家园,4室2厅1厨1卫,中楼层 (共18层),130㎡,平层,暂无数据,板塔结合,南,钢混结构,精装,两梯三户,有,暂无数据,2020-12-18,商品房,暂无数据,普通住宅,暂无数据,共有,无抵押,未上传房本照片,区环境优雅，配套成熟，交通便利，居住舒适,,,,位置：小区地理位置，绿化，居民素质高 配套：有健身器材，小型篮球场，可供小区居民使用 保安：小区内24保安巡逻 交通出行：小区出行便利。出小区门口就有共享单车，公交..,首套房90平以下成交价的1%，90平以上成交价的1.5%； 二套房90平以下1%，以上2%； 三套房不论大小均为3%,,此房产权清晰，房源真实，业主诚心出售，过户全程陪同，安心交易,,,,,,,,
529,朗诗競园精装4房2卫 六恒系统 满二 随时看房价格可谈,370万,20787,天宁区茶山,兢业园,4室2厅1厨2卫,高楼层 (共33层),178㎡,平层,暂无数据,板塔结合,南,钢混结构,精装,暂无数据,无,暂无数据,2023-06-20,商品房,暂无数据,普通住宅,暂无数据,共有,无抵押,未上传房本照片,朗诗競园精装4房2卫 六恒系统 满二 随时看房价格可谈,朝阳综合市场，大润发卖场，弘阳广场，德安医院，银行交通银行，中国工商银行，中国工商银行，邮政储蓄，弘阳广场。,此房无贷款，无抵押，产权清晰。房东对付款无要求，按照正常首付就可以。,,,税费解析：此房满二，故个税是1%。契税：首套房90平米以下是成交价的1％，90平米以上是成交价的1.5％； 二套房90平米以下是成交价的1％，90平米以上是成交价的2％；三套房是成交价的3％。,,,,,,,,,,
530,五角场东村西区 繁华闹市中的净土 诚心出售 满二年..,95万,12026,天宁区茶山,五角场东村西区,2室2厅1厨1卫,高楼层 (共6层),79㎡,跃层,暂无数据,塔楼,南,钢混结构,精装,两梯两户,有,暂无数据,2021-05-24,商品房,暂无数据,普通住宅,暂无数据,共有,无抵押,未上传房本照片,五角场东村西区 繁华闹市中的净土 诚心出售 满二年..,商场：红梅商场、金叶连锁(林园商场东南)、大润发、红星家具装饰城、金太阳家电北环商场、九龙小商品批发市场、世纪联华医院：武牧动物医院、武进动物医院，红梅医院、青龙医院九龙门诊部邮局：红梅邮政支局,,,,此房满2年，无增值税。首套房契税1.5%，二套房契税2%。三套房契税3%。个税1%,,,,,本小区适应年龄段不限，有红梅公园，东坡公园，菜场离得近，方便出行,,,,,
531,24.此房地理位置优越，小区配套、设施齐全，出入方便,368万,39570,天宁区茶山,国泰新都,2室1厅1厨1卫,中楼层 (共8层),93㎡,平层,暂无数据,板塔结合,南,钢混结构,精装,暂无数据,暂无数据,暂无数据,2021-05-03,商品房,暂无数据,普通住宅,暂无数据,共有,无抵押,未上传房本照片,24.此房地理位置优越，小区配套、设施齐全，出入方便,综合市场，*市，医院，银行交通银行，中国工商银行，中国工商银行，邮政储蓄,,"：
6路。16路，25路，231路，清凉寺站有2路，78路，217路，路边有环保单车，距地铁口几百米",,,,随时可签业主置换，诚心出售，看房方便，产证齐全，价格可谈， 欢迎看房，随时恭候,,,,,,,,
532,府河精装两房，景观房，采光好楼层佳，业主诚售。,245万,23410,天宁区茶山,府河名居,4室2厅1厨1卫,中楼层 (共30层),104.66㎡,复式,暂无数据,板塔结合,南,钢混结构,精装,一梯四户,有,暂无数据,2021-04-13,商品房,暂无数据,普通住宅,暂无数据,共有,无抵押,未上传房本照片,府河精装两房，景观房，采光好楼层佳，业主诚售。,医院：常春村社区卫生服务站、常州市中医院、德安医院、常州协和医院 银行：江南银行、中国邮政储蓄、中国工商银行、中国建设银行、中国银行、中国农业银行、招商银行 商场：仟亿家购物广场、常州购物 公园：东坡公园、人民公园、飞龙公园,,114米同济桥东：16路 D7 175米德安桥站：25路、D6路 258米通济桥东站：55路、D7路 317米劳动路龙游路站：16路、55路 1千米地铁口,,税费解析：此房满二，故个税是1%。契税：首套房90平米以下是成交价的1％，90平米以上是成交价的1.5％； 二套房90平米以下是成交价的1％，90平米以上是成交价的2％；三套房是成交价的3％.,,,,,,,,,,
533,银河湾明苑毛坯2房 有车位 毛坯可塑性强 房东诚售,205万,22366,天宁区茶山,银河湾明苑二期,2室2厅1厨1卫,低楼层 (共34层),91.66㎡,平层,暂无数据,板塔结合,南,钢混结构,毛坯,两梯六户,有,暂无数据,2022-06-18,商品房,暂无数据,普通住宅,暂无数据,共有,有抵押,未上传房本照片,小区地段好，毛坯可塑性强，有车位房东诚心出售 看中价格可谈。,朝阳综合市场，大润发，德安医院，银行交通银行，中国工商银行，中国工商银行，邮政储蓄.,此房产权清晰。房东对付款无要求，按照正常首付就可以。诚心出售,,,此房满二，故个税是1%。契税：首套房90平米以下是成交价的1％，90平米以上是成交价的1.5％； 二套房90平米以下是成交价的1％，90平米以上是成交价的2％；三套房是成交价的3％.,,,,,,,,,,
534,新城金郡 户型方正 精装修 拎包住,300万,23131,天宁区茶山,新城金郡,3室2厅1厨2卫,低楼层 (共26层),129.7㎡,平层,暂无数据,板塔结合,南 北,钢混结构,精装,两梯三户,有,暂无数据,2022-02-19,商品房,暂无数据,普通住宅,暂无数据,共有,有抵押 220万元 客户偿还,未上传房本照片,小区档次高，环境好，物业佳，居住有保障，全屋地暖，实木家具,,此房产权清晰，房源真实，业主诚心出售，看房方便，过户全程陪同,,本土品牌开发商新城地产开发和物业服务，品质优秀。 高绿化社区，24小时封闭物业服务，人员进出都会核验身份，避免打扰业主。,"、契税：首套房，90平米以下成交价的1％，90平米以上成交价的1.5％, 二套房90平以上成交价的2%,2、增值税：产证满2年免收增值税，未满2年征收5.6％； 3、个税：产证满五年而且是一套住房，免收个税，未满5年成交价的1%",,,,,,,,,,
535,出行方便，交通方便，靠市区，适宜居住，拎包入住,80万,12699,天宁区茶山,朝阳二村,2室1厅1厨1卫,高楼层 (共6层),63㎡,复式,暂无数据,板塔结合,南,混合结构,简装,暂无数据,无,暂无数据,2021-08-20,商品房,暂无数据,普通住宅,暂无数据,共有,无抵押,未上传房本照片,房源为本小区实在房源，环境优美，楼间开阔，居住舒适性高。,小区边有助力脚踏车，多路公交车站台，贯通龙城南北，出行便捷 ，离市区和九州商圈距离较短。,,小区边有助力脚踏车，多路公交车站台，贯通龙城南北，出行便捷 ，离市区和九州商圈距离较短。,,"契税：首套房，90平米以下成交价的1％，90平米以上成交价的1.5％, 二套房90平以上成交价的2%。",,,,,,,,,,
536,华润四期凯旋门 中间楼层 采光好 配套设施齐全,188万,19334,天宁区茶山,华润凯旋门,3室2厅1厨1卫,中楼层 (共32层),97.24㎡,平层,暂无数据,板塔结合,南,钢混结构,精装,暂无数据,暂无数据,暂无数据,2021-10-09,商品房,暂无数据,普通住宅,暂无数据,非共有,有抵押 30万元,未上传房本照片,华润四期凯旋门 中间楼层 采光好 配套设施齐全,生活设施齐 银行 菜场 商场 饮食近在咫尺 生活起居很方便。,此房产权清晰，房源真实，业主诚心出售，看房方便，过户全程陪同,,,,,业主现诚心出售，证件齐，欢迎看房，随时恭候，如看中房子，价格可谈,,,,,,,,
537,桃园公寓中层3居大大大的双阳台清爽装修,450万,36438,天宁区茶山,桃园公寓,3室2厅1厨2卫,中楼层 (共5层),123.5㎡,平层,暂无数据,板楼,南,砖混结构,精装,暂无数据,暂无数据,暂无数据,2021-09-30,商品房,暂无数据,普通住宅,暂无数据,共有,有抵押 200万元 邮政 业主自还,未上传房本照片,三开间朝南敞亮户型 双阳台  客厅大 中层采光优秀,,,"社区门口有公用电动自行车租赁、归还点，400M处元丰桥BRT站台有多路公交
地铁红梅公园站距社区300M，出行是相当的便利。","桃园公寓位于红梅公园南方向，社区24H物业服务，绿化高，社区里有水景公园（现在水池没有注水），紫藤、绿树很多
社区东侧1KM有东坡公园、儿童医院，一院、中医院、二院都在2KM范围内，医疗配套优秀。","此套房屋买受方首套1.5%，2套2%，3套及以上3%的契税
出让方个税1%。
产证工本费80元/本。",,,,,,,,,,
538,桃园新村 三房 简装 满五唯一 空置 楼层佳 采光好,248万,31393,天宁区茶山,桃园新村,3室1厅1厨1卫,中楼层 (共6层),79㎡,平层,暂无数据,板楼,南 北,砖混结构,简装,暂无数据,无,暂无数据,2021-07-15,商品房,暂无数据,普通住宅,暂无数据,非共有,无抵押,未上传房本照片,桃园新村 三房 简装 满五唯一 空置 楼层佳 采光好,生活设施齐 银行 菜场 商场 饮食近在咫尺 生活起居很方便。,此房产权清晰，房源真实，业主诚心出售，看房方便，过户全程陪同,,,,,业主现诚心出售，证件齐，欢迎看房，随时恭候，如看中房子，价格可谈,,,,,,,,
539,国泰新都  户型方正，通透性好,492万,40000,天宁区茶山,国泰新都,3室2厅1厨2卫,低楼层 (共11层),123㎡,平层,暂无数据,板塔结合,南,钢混结构,简装,暂无数据,暂无数据,暂无数据,2021-05-05,商品房,暂无数据,普通住宅,暂无数据,共有,无抵押,未上传房本照片,位置好，旁边是青果巷.........,,,交通方便，6路。16路，25路，231路，清凉寺站有2路，78路，217路，路边有环保单车，小区门口就是地铁一号线,,此房产权70年，契税首套房90平以下1%，90平以上1.5%二套房90平以下1%，90平以上2%，三套房不论面积都是3%,房间大，采光充足，落地玻璃窗，通透敞亮，格局好，利用率高，玻璃窗可做广告，悠闲居住，还能拿不菲的租金，位置好出行方便四通八达,,,,,,,,,
540,桃园新村4楼，位置好，出行方便,238万,30910,天宁区茶山,桃园新村,3室1厅1厨1卫,中楼层 (共5层),77㎡,平层,暂无数据,板楼,南,钢混结构,简装,暂无数据,暂无数据,暂无数据,2021-02-04,商品房,暂无数据,普通住宅,暂无数据,共有,有抵押 2万元,未上传房本照片,桃园新村4楼，位置好，出行方便,生活设施齐 银行 *市 菜场 商场 饮食近在咫尺 生活起居很方便。,此房产权清晰，房源真实，业主诚心出售，看房方便，过户全程陪同,,,,,业主现诚心出售，证件齐，欢迎看房，随时恭候，如看中房子，价格可谈。,,,,,,,,
541,三房朝南 户型方正 业主诚心急售,210万,17797,天宁区茶山,天鹅湖花园,3室2厅1厨1卫,高楼层 (共20层),118㎡,平层,暂无数据,板楼,南,钢混结构,精装,两梯四户,有,暂无数据,2021-10-05,商品房,暂无数据,普通住宅,暂无数据,共有,有抵押 20万元,未上传房本照片,此房边户通风效果好，户型格局方正，楼层好，采光佳。拎包入住,交通线路有： 10路、16路、 H1至丽华二村下车 丽华幼儿园 丽小 等 还配置多家银行 方便快捷！！,,,,,该房屋高楼层 三室外加个小书房两厅一厨两卫 采光好无遮挡 适合一家居住！,,,,适合刚需人群和楼梯房改善人群，可做婚房，楼下大润发，东边几百米有大型免费公园 ，可去锻炼身体和增进亲子关系,,,,,
