1041,精装2房 华润国际 随时看房 看房很方便,145万,16366,天宁区茶山,华润·中央公园,2室2厅1厨1卫,中楼层 (共32层),88.6㎡,平层,暂无数据,板楼,南,钢混结构,精装,两梯四户,有,暂无数据,2023-10-15,商品房,暂无数据,普通住宅,暂无数据,共有,有抵押 0万元 / 业主自还,未上传房本照片,房型方正，明厨明卫采光好，通透敞亮，三房朝南,,,,环境优美，小区内部环境好，绿化高，休闲设施齐全，儿童游乐场所，健身器材。24小时安保服务，管家式服务,首套房成交价的1.5%，二套房成交价的2%，三套房成交价的3%。 增值税：满2年免征，不满2年成交额征收5.6%。 个税：不满5年征收1%,户型方正朝南，格局布局好，空间感好，通透性强，居住舒适 2、南北朝向，视野开阔，采光透,,,,,,,,,
1042,桃园物资楼，精装修带阁楼，采光好，户型方正，诚售,290万,48014,天宁区茶山,桃园路物资楼,2室1厅1厨1卫,高楼层 (共6层),60.4㎡,复式,暂无数据,塔楼,南,钢混结构,精装,暂无数据,无,暂无数据,2022-01-15,商品房,暂无数据,普通住宅,暂无数据,共有,无抵押,未上传房本照片,此房满二，采光好，户型方正，楼层好，房东诚意出售,生活设施齐 银行 菜场 商场 饮食近在咫尺 生活起居很方便。此房产权清晰，房源真实，业主诚心出售，看房方便，过户全程陪同,,,,,,此房产权清晰，房源真实，业主诚心出售，看房方便，过户全程陪同,,,,,此房精装修，装修过后自住，有阁楼，目前房子空置中，户型方正，装修不错,,,
1043,小两房 拎包住 户型方正 楼层好无遮挡,155万,20130,天宁区茶山,华润凯旋门,2室1厅1厨1卫,高楼层 (共32层),77㎡,平层,暂无数据,板塔结合,南,钢混结构,精装,两梯四户,有,暂无数据,2022-07-28,商品房,暂无数据,普通住宅,暂无数据,共有,无抵押,未上传房本照片,房子硬装好的，可以拎包入住，二十多层采光很好。,兰陵大润发，丽华大润发，，华润万象城，凤凰公园，连锁酒店，湿地公园，各大银行，各类小吃美食一应,,,小区是华润自带物业安保和服务态度好，新小区环境好，配套齐，适合改善需求。 2、小区地理位置优越，交通便捷，旁边就是地铁1号线。小区内道路人车分流，设有滑滑梯，跷跷板等，儿童娱乐设施。老人休闲设施。生活配套齐全，万象城在建,首套 90平以下1% 。2，首套 90平及以上1.5% 。3，二套90平以下1% 。4，二套90平及以上2% 。5，三套都是3% 个人所得税：不是满五唯一年1%,,,,,,,,,,
1044,朝阳二村精装2房 中间楼层 看房方便,45万,13703,天宁区茶山,朝阳一村,1室1厅1厨1卫,低楼层 (共4层),32.84㎡,平层,暂无数据,暂无数据,南,未知结构,简装,暂无数据,暂无数据,暂无数据,2022-02-16,商品房,暂无数据,普通住宅,暂无数据,共有,无抵押,未上传房本照片,朝阳二村精装2房 中间楼层 看房方便,户型周正，格局分布合理，空间感好，通透性强，居住舒适；精装两房房,,,,税费解析：此房满五唯一，故个税是0%。契税：首套房90平米以下是成交价的1％，90平米以上是成交价的1.5％； 二套房90平米以下是成交价的1％，90平米以上是成交价的2％；三套房是成交价的3％.,户型周正，格局分布合理，空间感好，通透性强，居住舒适；精装两房房,,,,,,,,,
1045,南北通风 楼层佳  阳光采光好 房东诚心出售,65万,9970,天宁区茶山,丽华二村,2室1厅1厨1卫,中楼层 (共6层),65.2㎡,平层,暂无数据,板塔结合,南,钢混结构,简装,暂无数据,暂无数据,暂无数据,2022-03-08,商品房,暂无数据,普通住宅,暂无数据,共有,无抵押,未上传房本照片,南北通风 楼层佳  阳光采光好 房东诚心出售,丽华大润发，兰陵大润发，连锁酒店，蔷薇湿地公园和体育公园，各大银行，各类小吃美食一应。 房主自荐(业主对房源的描述),,,小区生活实施齐全，商场，菜市场，银行等。 2：小区内有健身器材，小型篮球场，可供小区居民使用。 3：小区停车位充足。,契税：首套房，90平米以下成交价的1%，90平米以上成交价的1.5%；二套房90平米以上的成交价的2%。2 增值税:产证满2年免收增值税。3 个税：产证满5年而且是唯一一套住房，免收个税。,,,,,,,,,,
1046,此房通风效果好，户型格局方正，楼层好，采光佳。,159万,13250,天宁区茶山,天鹅湖花园,3室2厅1厨1卫,中楼层 (共24层),120㎡,平层,暂无数据,塔楼,南 北,钢混结构,精装,两梯四户,有,暂无数据,2022-02-18,商品房,暂无数据,普通住宅,暂无数据,非共有,无抵押,未上传房本照片,此房通风效果好，户型格局方正，楼层好，采光佳。,,,交通线路有： 10路、16路、 H1至丽华二村下车 丽华幼儿园 丽小 等 还配置多家银行 方便快捷！,,契税：首套房，90平米以下成交价的1%，90平米以上成交价的1.5%；二套房90平米以上的成交价的2%。2 增值税:产证满2年免收增值税。3 个税：产证满5年而且是唯一一套住房，免收个税,,,,,适合刚需人群和楼梯房改善人群，可做婚房，楼下大润发，东边几百米有大型免费公园 ，可去锻炼身体和增进亲子关系,,,,,
1047,"户型方正,视野宽阔,采光充足,配套设施齐全,交通便利",35万,6731,天宁区茶山,金钻公寓,2室1厅1厨1卫,中楼层 (共4层),52㎡,平层,暂无数据,塔楼,南,钢混结构,精装,暂无数据,无,暂无数据,2020-10-12,商品房,暂无数据,普通住宅,暂无数据,非共有,无抵押,未上传房本照片,"户型方正,视野宽阔,采光充足,配套设施齐全,交通便利",,"此房产权清晰,房源真实,业主诚心出售,看房方便,过户全程陪同",,,"契税:首套房,90平米以下成交价的1%,90平米以上成交价的15%,二套房,90平
以下成交价的1%,90平以上成交价的2%,三套及以上,成交价的3%;2、个税:产
证满五唯一,免收个税,不唯一交成交价的1%",,"业主现诚心出售,证件齐,欢迎看房,随时恭候,如看中房子,价格可谈。",,,,,,,,
1048,带内阁楼，买一层得两层，新精装十几万，四房，满两年,238万,37188,天宁区茶山,桃园新村,4室2厅1厨2卫,高楼层 (共5层),64㎡,复式,暂无数据,板楼,南 北,砖混结构,精装,暂无数据,暂无数据,暂无数据,2021-09-02,商品房,暂无数据,普通住宅,暂无数据,共有,有抵押 50万元 客户偿还,未上传房本照片,带内阁楼，买一层得两层，新精装十几万，四房，满两年,小区附 近有商场，菜场，地铁，医院，红梅公园和东坡公园，生活设施一应俱全,,,,,户型方正，厅房分离，私密性比较好 ，冬天阳光直射房间，生活很舒适,,,,本小区适应年龄段不限，有红梅公园，东坡公园，菜场离得近，方便出行,,,,,
1049,优选好房，随时看房，价格可谈。,53万,11565,天宁区茶山,清凉新村东区,1室1厅1厨1卫,低楼层 (共3层),45.83㎡,平层,暂无数据,板塔结合,东 西,钢混结构,简装,暂无数据,无,暂无数据,2020-08-02,商品房,暂无数据,普通住宅,暂无数据,共有,无抵押,未上传房本照片,小区环境优雅，配套成熟，交通便利，居住舒适。,,此房产权清晰，房源真实，业主诚心出售，过户全程陪同，安心交易。,,"小区环境优美，舒适安静适宜居住；
1、出门即有公交菜场，银行*市美食等生活配套。
2、小区内有健身器材，可供小区居民使用；
3、小区内停车位充足，建有地上停车场和地下车库。
4、小区内24小时保安巡逻。",,格局分布合理，户型方正视野好通透性强，空间感好，全天采光，干湿分离，明厨明卫。,,,,,,,,,
1050,88平2房 精装 华润剑桥澜湾 环境好 自住舒适,178万,20000,天宁区茶山,华润国际社区剑桥澜湾,2室1厅1厨1卫,中楼层 (共32层),89㎡,平层,暂无数据,板塔结合,南,钢混结构,精装,两梯三户,有,暂无数据,2023-03-16,商品房,暂无数据,普通住宅,暂无数据,共有,有抵押 0万元 / 业主自还,未上传房本照片,房型方正，明厨明卫采光好，精装修保养新,,,,环境优美，小区内部环境好，绿化高，休闲设施齐全，儿童游乐场所，健身器材。24小时安保服务，管家式服务,,户型方正朝南，格局布局好，空间感好，通透性强，居住舒适 2、南北朝向，视野开阔，采光透,卖掉多余的房子，自己住的 ，保养新 ，诚心出售 ，看好可以谈价格,,,,,,,,
1051,桃园新村精装三房装修保养好户型方正南北通风,288万,40564,天宁区茶山,桃园新村,2室1厅1厨1卫,中楼层 (共5层),71㎡,平层,暂无数据,板楼,南,砖混结构,精装,暂无数据,无,暂无数据,2022-08-23,商品房,暂无数据,普通住宅,暂无数据,共有,无抵押,未上传房本照片,满五，精装，保养好，户型方正，南北通风，采光好，没小孩读书。,,,"：
小区门口就有共享单车停车点，南门50米处就有公交站台，800米处有地铁一号线站点，地处繁华，打车也方便。",小区西门口10米处有菜场，大型商场，饭店，50米处有银行，600米处是红梅公园，800米处有东坡公园。,"1、契税：首套房，90平米以下成交价的1％，90平米以上成交价的1.5％, 二套房90平以上成交价的2%, 2、增值税：产证满2年免收增值税，未满2年征收5.6％； 3、个税：产证满五年而且是一套住房，免收个税，未满5年成交价的1%",,,,,,,,,,
1052,天鹅湖花园三朝南诚心出售、南北通透,160万,14160,天宁区茶山,天鹅湖花园,2室2厅1厨1卫,中楼层 (共28层),113㎡,平层,暂无数据,塔楼,南 北,钢混结构,精装,两梯五户,有,暂无数据,2022-02-17,商品房,暂无数据,普通住宅,暂无数据,共有,无抵押,未上传房本照片,格局好，采光好，户型方正 ，配套全，交通便利。,丽华大润发，兰陵大润发，连锁酒店，湿地公园，各大银行，各类小吃美食一应俱全,,,小区配套成熟，生活方便，出行方便，小区生活实施齐全，商场，，菜市场，银行等。 小区内有健身器材，小型篮球场，可供小区居民使用。,契税：首套房，90平米以下成交价的1%，90平米以上成交价的1.5%；二套房90平米以上的成交价的2%。2 增值税:产证满2年免收增值税。3 个税：产证满5年而且是唯一一套住房，免收个税。,,,,,,,,,,
1053,清凉新村，顶楼外楼梯，实用面积大。,68万,10462,天宁区茶山,清凉新村,2室1厅1厨1卫,高楼层 (共6层),65㎡,平层,暂无数据,板楼,南,砖木结构,简装,暂无数据,无,暂无数据,2021-05-08,商品房,暂无数据,普通住宅,暂无数据,共有,无抵押,未上传房本照片,清凉新村，顶楼外楼梯，实用面积大。,,此房产权清晰，房源真实，业主诚心出售，过户全程陪同，安心交易。,,,契税：首套房90平以下成交价的1%，90平以上成交价的1.5%； 二套房90平以下1%，以上2%； 三套房不论大小均为3%。 个税：产证满五年且是家庭唯一住房，免收个税，未满5年或不是家庭唯一住房成交价的1%。,,随时可签业主置换，诚心出售，看房方便，产证齐全，价格可谈，。 欢迎看房，随时恭候。,,,,,,,,
1054,华润五期 凯旋门二期 毛坯三房 楼层佳 采光好,188万,21124,天宁区茶山,华润凯旋门二期,3室2厅1厨1卫,中楼层 (共33层),89㎡,平层,暂无数据,板塔结合,南,钢混结构,毛坯,两梯四户,有,暂无数据,2021-08-11,商品房,暂无数据,普通住宅,暂无数据,共有,有抵押 50万元,未上传房本照片,此房户型格局好，楼层好、视野宽阔、采光充足、配套齐全,,,,,满2年，免增值税。 契税：首套房，90平米以下成交价的1%，90平米以上成交价的1.5%；二套房90平米以上的成交价的2%。2 增值税:产证满2年免收增值税。3 个税：,,此房户型格局好，楼层好、视野宽阔、采光充足、配套齐全 业主诚心出售，l手续齐全，价格公道，看房方便,,,孕婴老幼 本房是大三房 三房两卫双阳台，小区人车分流 人文环境好， 小区配套齐全，有菜市场 公园，有电梯 贷款方式不限 适合首付不多的小家庭,,,,,
1055,70年产权公寓，精装修拎包入住,66万,15349,天宁区茶山,和平国际花苑,1室1厅1厨1卫,高楼层 (共9层),43㎡,平层,暂无数据,板塔结合,南,钢混结构,精装,两梯十四户,有,暂无数据,2021-09-05,商品房,暂无数据,普通住宅,暂无数据,共有,无抵押,未上传房本照片,户型周正，格局分布合理，空间感好，通透性强。,,此房产权清晰，房源真实，业主诚心出售，看房方便，过户全程陪同,门口有公交车，BRT、和地铁1号线。中吴大道，地处常州中间位置，上常州哪里都方便。,,"契税：首套房，90平米以下成交价的1％，90平米以上成交价的1.5％, 二套房90平以上成交价的2%。",,,,,,,,,,
1056,大润发高cheng天鹅湖丽华二村旁蔷薇家园,117万,13000,天宁区茶山,蔷薇家园,2室2厅1厨1卫,高楼层 (共24层),90㎡,平层,暂无数据,板塔结合,南,钢混结构,精装,三梯九户,有,暂无数据,2022-03-20,商品房,暂无数据,普通住宅,暂无数据,共有,无抵押,未上传房本照片,小区地理位置优越，生活交通配套便利，户型方正,成熟社区，配套设施齐全，菜场，娱乐场所，公园。适合居住。小区内有健身器材,,,小区生活实施齐全，商场，，菜市场，银行等。 2：小区内有健身器材，小型篮球场，可供小区居民使用。 3：小区停车位充足,1、契税：首套房，90平米以下1%，90平米以上1.5%。 二套房：90平米以下1%，90平米以上2%。2、增值税：总额征收5.6%，产证满2年免收,,,,,,,,,,
1057,银河湾明苑3房 诚心出售，楼层佳，采光好，价格可谈,180万,19566,天宁区茶山,银河湾明苑二期,3室2厅1厨1卫,中楼层 (共34层),92㎡,平层,暂无数据,板塔结合,南,钢混结构,毛坯,两梯六户,有,暂无数据,2021-05-12,商品房,暂无数据,普通住宅,暂无数据,共有,无抵押,未上传房本照片,房东诚心出售，楼层佳，采光好。价格可谈。毛坯 欢迎看房。,朝阳综合市场，大润发*市，德安医院，银行交通银行，中国工商银行，中国工商银行，邮政储蓄.,此房产权清晰。房东对付款无要求，按照正常首付就可以。诚心出售,,,此房满二，故个税是1%。契税：首套房90平米以下是成交价的1％，90平米以上是成交价的1.5％； 二套房90平米以下是成交价的1％，90平米以上是成交价的2％；三套房是成交价的3％.,,,,,,,,,,
1058,清凉新村，两房，采光好，带车位,85万,12593,天宁区茶山,清凉新村158-3-8,2室1厅1厨1卫,高楼层 (共6层),67.5㎡,平层,暂无数据,板塔结合,南,钢混结构,简装,暂无数据,暂无数据,暂无数据,2023-02-08,商品房,暂无数据,普通住宅,暂无数据,共有,无抵押,未上传房本照片,此房真实在售，两房朝南，目前空置，随时可以看房。,成熟商圈，配套齐全，银行，医院，饭店，小吃，离九洲近，吃喝玩乐都全。,此房产权清晰，房源真实，业主诚心出售，看房方便，过户全程陪同,,,"1、契税：首套房，90平米以下成交价的1％,二套房90平以下成交价的1.5% 2、个税：产证不是满五年一的住房，成交价的1%",,,,,,,,,,
1059,大润发中海旁天鹅湖花园精装修朝南户型出售,170万,15045,天宁区茶山,天鹅湖花园,2室2厅1厨1卫,高楼层 (共28层),113㎡,平层,暂无数据,塔楼,南,钢混结构,精装,两梯五户,有,暂无数据,2022-03-06,商品房,暂无数据,普通住宅,暂无数据,共有,无抵押,未上传房本照片,此房 楼层好 采光好 楼下大润发入口 生活便利,,,交通线路有： 10路、16路至丽华二村下车 丽华幼儿园 丽小 等 还配置多家银行 方便快捷！,,,该房屋高楼层，带一个大露台朝南的、 采光好无遮挡 适合一家居住......,,,,适合刚需人群和楼梯房改善人群，可做婚房，楼下大润发，东边几百米有大型免费公园 ，可去锻炼身体和增进亲子关系,,,,,
1060,新乐花园 2室2厅 南,158万,17751,天宁区茶山,新乐花园,2室2厅1厨1卫,高楼层 (共18层),89.01㎡,平层,暂无数据,板塔结合,南,钢混结构,精装,两梯四户,有,暂无数据,2022-11-11,商品房,暂无数据,普通住宅,暂无数据,非共有,无抵押,未上传房本照片,,,,,,,,,,,,,,,,
1061,精装3房，户型方正，采光无遮，小区环境优美。,220万,17742,天宁区茶山,新乐花园,3室2厅1厨1卫,高楼层 (共18层),124㎡,平层,暂无数据,板塔结合,南,钢混结构,精装,两梯三户,有,暂无数据,2020-08-01,商品房,暂无数据,普通住宅,暂无数据,共有,无抵押,未上传房本照片,此房楼层还好，精装3房，户型方正，采光无遮，小区环境优美。,,,,供 水：市政供水，水电表均为一户一表，每户独立水供 暖：自采暖供 电：市政供电220V~250V燃 气：管道天然气通讯设备：光纤网络接口 停 车 位：共1139个车位，地下1014个，地面125个！！,"契税：A首套 90平以下1% B首套 90平以上1.5% C二套90平以下1% D二套90平以上2% E三套都是3% 增值税：满两年免征 不满2年权.额征收5.6% 个人所得税：不满5年征1%

售房详情：
业主现诚心置换，证件齐，欢迎看房，随时恭候，如看中房子，价格可谈！！",,"：
业主现诚心置换，证件齐，欢迎看房，随时恭候，如看中房子，价格可谈！！",,,,,,,,
1062,清凉新村 使用面积大 得房率高 采光足,130万,13403,天宁区茶山,清凉新村,4室2厅1厨2卫,高楼层 (共7层),97㎡,复式,暂无数据,暂无数据,南,未知结构,简装,暂无数据,暂无数据,暂无数据,2021-01-17,商品房,暂无数据,普通住宅,暂无数据,非共有,无抵押,未上传房本照片,内阁楼 使用面积大 采光足 得房率高 配套设施齐全,商场：沿街商铺医院：中医院南院邮局：浦前邮政支局银行：中国银行同济花园分理处、工商银行其他：张太雷故居、人民公园,此房产权清晰，没有抵押，业主诚心出售，看房方便，过户全程陪同,,所属区域：天宁 茶山邮 编：213000产权描述：70年物业类别：住宅建筑年代：2000年建成建筑结构：钢筋混凝土、砖混建筑类型：楼栋总数：44。,"1、契税：首套房，90平米以下成交价的1％，90平米以上成交价的1.5％, 二套房90平以上成交价的2%； 2、增值税：产证满2年免收增值税，未满2年征收5.6％",,,,,,,,,,
1063,东方花园简装2室，楼层采光好，四周配套齐全,108万,11581,天宁区茶山,东方花园(天宁区),2室2厅1厨1卫,高楼层 (共6层),93.26㎡,错层,暂无数据,板塔结合,南,钢混结构,简装,暂无数据,暂无数据,暂无数据,2020-05-05,商品房,暂无数据,普通住宅,暂无数据,共有,无抵押,未上传房本照片,东方花园简装2室，楼层采光好，四周配套齐全,综合市场，*市，医院，银行交通银行，中国工商银行，中国工商银行，邮政储蓄.,此房无贷款，无抵押，产权清晰。房东对付款无要求，按照正常首付就可以。,,,此房满二，故个税是1%。契税：首套房90平米以下是成交价的1％，90平米以上是成交价的1.5％； 二套房90平米以下是成交价的1％，90平米以上是成交价的2％；三套房是成交价的3％.,,,,,,,,,,
1064,安信颐和精装2房 中间楼层采光好 满二 全屋空调+地暖,142万,17975,天宁区茶山,安信颐和,2室2厅1厨1卫,高楼层 (共16层),79㎡,平层,暂无数据,塔楼,南,混合结构,精装,暂无数据,无,暂无数据,2021-05-30,商品房,暂无数据,普通住宅,暂无数据,共有,有抵押 50万元,未上传房本照片,安信颐和精装2房 中间楼层采光好 满二 全屋空调+地暖,朝阳综合市场，大润发大卖场，德安医院，银行交通银行，中国工商银行，中国工商银行，邮政储蓄.,此房有贷款，产权清晰。房东对付款无要求，按照正常首付就可以。,,,税费解析：此房满二，故个税是1%。契税：首套房90平米以下是成交价的1％，90平米以上是成交价的1.5％； 二套房90平米以下是成交价的1％，90平米以上是成交价的2％；三套房是成交价的3％.,,,,,,,,,,
1065,新城逸境园好房出售，采光好，户型佳，看房方便。,250万,15272,天宁区茶山,新城逸境园,3室2厅1厨2卫,高楼层 (共18层),163.7㎡,复式,暂无数据,板塔结合,南,钢混结构,精装,一梯三户,有,暂无数据,2021-01-25,商品房,暂无数据,普通住宅,暂无数据,共有,无抵押,未上传房本照片,新城逸境园精装房 房东诚售 价格可谈,综合市场，*市，医院，银行交通银行，中国工商银行，中国工商银行，邮政储蓄.,此房产权清晰，房东对付款无要求，按照正常首付就可以，过户时全程陪同。,,,税费解析：契税：首套房90平米以下是成交价的1％，90平米以上是成交价的1.5％； 二套房90平米以下是成交价的1％，90平米以上是成交价的2％；三套房是成交价的3％.,,,,,,,,,,
1066,配套全，旁边大润发*市，交通便利,48万,8183,天宁区茶山,天鹅湖花园,1室1厅1厨1卫,高楼层 (共30层),58.66㎡,平层,暂无数据,塔楼,西,钢混结构,毛坯,两梯十三户,有,暂无数据,2021-05-24,商品房,暂无数据,商住两用,暂无数据,共有,无抵押,未上传房本照片,采光好，户型方正 ，配套全，旁边大润发*市，交通便利,丽华大润发*市，连锁酒店，湿地公园，各大银行，各类小吃美食一应俱全。,,,小区生活实施齐全，商场，*市，菜市场，银行等。 2：小区内有健身器材，小型篮球场，可供小区居民使用。 3：小区停车位充足二十四小时保安巡逻,首套 90平米以下（包含90）1％ 首套 90平米以上1.5％ 二套90平米以下（包含90）1％ 二套90平米以上2％ 三套 3％ 2．增值税： 满2年免征， 不满2年总房价征收5.6％ 3．个人所得税：不满5年征1％，满5年且房东名下只有一套住房可免征1％,,,,,,,,未知,未知,2.72元/m3
1067,华润凯旋门二期 3室2厅 南,160万,17978,天宁区茶山,华润凯旋门二期,3室2厅1厨1卫,中楼层 (共33层),89㎡,平层,暂无数据,板塔结合,南,钢混结构,毛坯,两梯四户,有,暂无数据,2021-01-10,商品房,暂无数据,普通住宅,暂无数据,共有,无抵押,未上传房本照片,,,,,,,,,,,,,,,,
1068,中间楼层视野宽阔采光充足交通便利,100万,14815,天宁区茶山,清凉新村东区,4室2厅1厨2卫,高楼层 (共5层),67.5㎡,复式,暂无数据,板塔结合,南,钢混结构,简装,暂无数据,无,暂无数据,2020-10-28,商品房,暂无数据,普通住宅,暂无数据,共有,无抵押,未上传房本照片,中间楼层视野宽阔采光充足配套设施齐全交通便利,离小区大概800就有*市和菜场，小区楼下也有公交站牌，交通便利,,,小区只有几栋房子小区里面安静适合老人和新婚夫妻居住环境好安静,,,,,,本小区适合老人，新婚夫妻，小孩居住，距离菜场和*市公交站牌近,,,,,
1069,朝阳高品质小区朗诗竞园精装2房！看房方便价格可谈！,190万,22094,天宁区茶山,兢业园,2室2厅1厨1卫,中楼层 (共33层),86㎡,平层,暂无数据,板塔结合,南 北,钢混结构,精装,两梯三户,有,暂无数据,2021-02-26,商品房,暂无数据,普通住宅,暂无数据,共有,无抵押,未上传房本照片,朗诗競园精装2房2厅 6恒系统 居住舒适 有车位,朝阳综合市场，大润发*市，德安医院，银行交通银行，中国工商银行，中国工商银行，邮政储蓄.,此房无贷款，无抵押，产权清晰。房东对付款无要求，按照正常首付就可以,,,税费解析：此房满二，故个税是1%。契税：首套房90平米以下是成交价的1％，90平米以上是成交价的1.5％； 二套房90平米以下是成交价的1％，90平米以上是成交价的2％；三套房是成交价的3％.,,,,,,,,,,
